00:59:57.996955 eth0  In  IP (tos 0x0, ttl 48, id 41910, offset 0, flags [DF], proto TCP (6), length 76)
    140.82.113.4.https > fv-az1720-213.5vs45zvnpbiehoyyevf2d3pjfe.cx.internal.cloudapp.net.42018: Flags [P.], cksum 0x941c (correct), seq 1443394582:1443394606, ack 836921642, win 73, options [nop,nop,TS val 2603001802 ecr 4113687191], length 24
00:59:57.996955 eth0  In  IP (tos 0x0, ttl 48, id 41911, offset 0, flags [DF], proto TCP (6), length 52)
    140.82.113.4.https > fv-az1720-213.5vs45zvnpbiehoyyevf2d3pjfe.cx.internal.cloudapp.net.42018: Flags [F.], cksum 0x48b6 (correct), seq 24, ack 1, win 73, options [nop,nop,TS val 2603001802 ecr 4113687191], length 0
00:59:57.997006 eth0  Out IP (tos 0x0, ttl 64, id 59783, offset 0, flags [DF], proto TCP (6), length 52)
    fv-az1720-213.5vs45zvnpbiehoyyevf2d3pjfe.cx.internal.cloudapp.net.42018 > 140.82.113.4.https: Flags [.], cksum 0x0808 (incorrect -> 0xd177), ack 24, win 600, options [nop,nop,TS val 4113717191 ecr 2603001802], length 0
00:59:57.997074 eth0  Out IP (tos 0x0, ttl 64, id 59784, offset 0, flags [DF], proto TCP (6), length 76)
    fv-az1720-213.5vs45zvnpbiehoyyevf2d3pjfe.cx.internal.cloudapp.net.42018 > 140.82.113.4.https: Flags [P.], cksum 0x0820 (incorrect -> 0xb879), seq 1:25, ack 25, win 600, options [nop,nop,TS val 4113717192 ecr 2603001802], length 24
00:59:57.997096 eth0  Out IP (tos 0x0, ttl 64, id 59785, offset 0, flags [DF], proto TCP (6), length 52)
    fv-az1720-213.5vs45zvnpbiehoyyevf2d3pjfe.cx.internal.cloudapp.net.42018 > 140.82.113.4.https: Flags [F.], cksum 0x0808 (incorrect -> 0xd15c), seq 25, ack 25, win 600, options [nop,nop,TS val 4113717192 ecr 2603001802], length 0
00:59:58.002899 eth0  In  IP (tos 0x0, ttl 48, id 0, offset 0, flags [DF], proto TCP (6), length 40)
    140.82.113.4.https > fv-az1720-213.5vs45zvnpbiehoyyevf2d3pjfe.cx.internal.cloudapp.net.42018: Flags [R], cksum 0x37ea (correct), seq 1443394607, win 0, length 0
00:59:58.002899 eth0  In  IP (tos 0x0, ttl 48, id 0, offset 0, flags [DF], proto TCP (6), length 40)
    140.82.113.4.https > fv-az1720-213.5vs45zvnpbiehoyyevf2d3pjfe.cx.internal.cloudapp.net.42018: Flags [R], cksum 0x37ea (correct), seq 1443394607, win 0, length 0
00:59:58.671431 eth0  Out IP (tos 0x0, ttl 64, id 63447, offset 0, flags [DF], proto TCP (6), length 52)
    fv-az1720-213.5vs45zvnpbiehoyyevf2d3pjfe.cx.internal.cloudapp.net.35566 > 20.221.96.90.https: Flags [F.], cksum 0x7fe8 (incorrect -> 0xbec4), seq 681596006, ack 2968265740, win 658, options [nop,nop,TS val 2012404149 ecr 4023129478], length 0
00:59:58.704782 eth0  In  IP (tos 0x0, ttl 46, id 10371, offset 0, flags [DF], proto TCP (6), length 52)
    20.221.96.90.https > fv-az1720-213.5vs45zvnpbiehoyyevf2d3pjfe.cx.internal.cloudapp.net.35566: Flags [F.], cksum 0x9e26 (correct), seq 1, ack 1, win 566, options [nop,nop,TS val 4023203454 ecr 2012404149], length 0
00:59:58.704807 eth0  Out IP (tos 0x0, ttl 64, id 63448, offset 0, flags [DF], proto TCP (6), length 52)
    fv-az1720-213.5vs45zvnpbiehoyyevf2d3pjfe.cx.internal.cloudapp.net.35566 > 20.221.96.90.https: Flags [.], cksum 0x7fe8 (incorrect -> 0x9da9), ack 2, win 658, options [nop,nop,TS val 2012404182 ecr 4023203454], length 0
00:59:59.910503 eth0  Out IP (tos 0x0, ttl 64, id 65365, offset 0, flags [none], proto UDP (17), length 70)
    fv-az1720-213.5vs45zvnpbiehoyyevf2d3pjfe.cx.internal.cloudapp.net.57504 > 168.63.129.16.domain: 19073+ [1au] A? api.nuget.org. (42)
00:59:59.915236 eth0  In  IP (tos 0x0, ttl 128, id 50875, offset 0, flags [none], proto UDP (17), length 302)
    168.63.129.16.domain > fv-az1720-213.5vs45zvnpbiehoyyevf2d3pjfe.cx.internal.cloudapp.net.57504: 19073 7/0/1 api.nuget.org. CNAME nugetapiprod.trafficmanager.net., nugetapiprod.trafficmanager.net. CNAME apiprod-mscdn.azureedge.net., apiprod-mscdn.azureedge.net. CNAME apiprod-mscdn.afd.azureedge.net., apiprod-mscdn.afd.azureedge.net. CNAME azureedge-t-prod.trafficmanager.net., azureedge-t-prod.trafficmanager.net. CNAME shed.dual-low.s-part-0013.t-0009.t-msedge.net., shed.dual-low.s-part-0013.t-0009.t-msedge.net. CNAME s-part-0013.t-0009.t-msedge.net., s-part-0013.t-0009.t-msedge.net. A 13.107.246.41 (274)
01:00:00.105197 eth0  Out IP (tos 0x0, ttl 64, id 6513, offset 0, flags [DF], proto TCP (6), length 60)
    fv-az1720-213.5vs45zvnpbiehoyyevf2d3pjfe.cx.internal.cloudapp.net.54688 > 168.63.129.16.http: Flags [S], cksum 0x3409 (incorrect -> 0x383d), seq 3158316394, win 64240, options [mss 1460,sackOK,TS val 1701499889 ecr 0,nop,wscale 7], length 0
01:00:00.105497 eth0  In  IP (tos 0x0, ttl 128, id 50876, offset 0, flags [DF], proto TCP (6), length 60)
    168.63.129.16.http > fv-az1720-213.5vs45zvnpbiehoyyevf2d3pjfe.cx.internal.cloudapp.net.54688: Flags [S.], cksum 0x62d7 (correct), seq 1975491766, ack 3158316395, win 65535, options [mss 1460,nop,wscale 8,sackOK,TS val 1978746845 ecr 1701499889], length 0
01:00:00.105529 eth0  Out IP (tos 0x0, ttl 64, id 6514, offset 0, flags [DF], proto TCP (6), length 52)
    fv-az1720-213.5vs45zvnpbiehoyyevf2d3pjfe.cx.internal.cloudapp.net.54688 > 168.63.129.16.http: Flags [.], cksum 0x3401 (incorrect -> 0x8fae), ack 1, win 502, options [nop,nop,TS val 1701499889 ecr 1978746845], length 0
01:00:00.105560 eth0  Out IP (tos 0x0, ttl 64, id 6515, offset 0, flags [DF], proto TCP (6), length 252)
    fv-az1720-213.5vs45zvnpbiehoyyevf2d3pjfe.cx.internal.cloudapp.net.54688 > 168.63.129.16.http: Flags [P.], cksum 0x34c9 (incorrect -> 0x9f4f), seq 1:201, ack 1, win 502, options [nop,nop,TS val 1701499889 ecr 1978746845], length 200: HTTP, length: 200
	GET /machine/?comp=goalstate HTTP/1.1
	Host: 168.63.129.16
	Accept-Encoding: identity
	x-ms-agent-name: WALinuxAgent
	x-ms-version: 2012-11-30
	Connection: close
	User-Agent: WALinuxAgent/2.13.1.1
	
01:00:00.106953 eth0  In  IP (tos 0x0, ttl 128, id 18109, offset 0, flags [DF], proto TCP (6), length 2440)
    168.63.129.16.http > fv-az1720-213.5vs45zvnpbiehoyyevf2d3pjfe.cx.internal.cloudapp.net.54688: Flags [FP.], cksum 0x3d55 (incorrect -> 0x7888), seq 1:2389, ack 201, win 16387, options [nop,nop,TS val 1978746845 ecr 1701499889], length 2388: HTTP, length: 2388
	HTTP/1.1 200 OK
	Content-Type: text/xml; charset=utf-8
	Server: Microsoft-IIS/10.0
	Date: Sat, 24 May 2025 00:59:59 GMT
	Connection: close
	Content-Length: 2224
	
	<?xml version="1.0" encoding="utf-8"?>
	<GoalState xmlns:xsi="http://www.w3.org/2001/XMLSchema-instance" xsi:noNamespaceSchemaLocation="goalstate10.xsd">
	  <Version>2012-11-30</Version>
	  <Incarnation>1</Incarnation>
	  <Machine>
	    <ExpectedState>Started</ExpectedState>
	    <StopRolesDeadlineHint>300000</StopRolesDeadlineHint>
	    <LBProbePorts>
	      <Port>16001</Port>
	    </LBProbePorts>
	    <ExpectHealthReport>FALSE</ExpectHealthReport>
	  </Machine>
	  <Container>
	    <ContainerId>53011767-77ae-4b65-b198-2f2f03dae266</ContainerId>
	    <RoleInstanceList>
	      <RoleInstance>
	        <InstanceId>f50e4b26-82ca-4d1e-bb16-7167849ca85d._EUS2-GCUS1U24J110J51-0073</InstanceId>
	        <State>Started</State>
	        <Configuration>
	          <HostingEnvironmentConfig>http://168.63.129.16:80/machine/53011767-77ae-4b65-b198-2f2f03dae266/f50e4b26%2D82ca%2D4d1e%2Dbb16%2D7167849ca85d.%5FEUS2%2DGCUS1U24J110J51%2D0073?comp=config&amp;type=hostingEnvironmentConfig&amp;incarnation=1</HostingEnvironmentConfig>
	          <SharedConfig>http://168.63.129.16:80/machine/53011767-77ae-4b65-b198-2f2f03dae266/f50e4b26%2D82ca%2D4d1e%2Dbb16%2D7167849ca85d.%5FEUS2%2DGCUS1U24J110J51%2D0073?comp=config&amp;type=sharedConfig&amp;incarnation=1</SharedConfig>
	          <ExtensionsConfig>http://168.63.129.16:80/machine/53011767-77ae-4b65-b198-2f2f03dae266/f50e4b26%2D82ca%2D4d1e%2Dbb16%2D7167849ca85d.%5FEUS2%2DGCUS1U24J110J51%2D0073?comp=config&amp;type=extensionsConfig&amp;incarnation=1</ExtensionsConfig>
	          <FullConfig>http://168.63.129.16:80/machine/53011767-77ae-4b65-b198-2f2f03dae266/f50e4b26%2D82ca%2D4d1e%2Dbb16%2D7167849ca85d.%5FEUS2%2DGCUS1U24J110J51%2D0073?comp=config&amp;type=fullConfig&amp;incarnation=1</FullConfig>
	          <Certificates>http://168.63.129.16:80/machine/53011767-77ae-4b65-b198-2f2f03dae266/f50e4b26%2D82ca%2D4d1e%2Dbb16%2D7167849ca85d.%5FEUS2%2DGCUS1U24J110J51%2D0073?comp=certificates&amp;incarnation=1</Certificates>
	          <ConfigName>f50e4b26-82ca-4d1e-bb16-7167849ca85d.1.f50e4b26-82ca-4d1e-bb16-7167849ca85d.1._EUS2-GCUS1U24J110J51-0073.1.xml</ConfigName>
	        </Configuration>
	      </RoleInstance>
	    </RoleInstanceList>
	  </Container>
	</GoalState> [|http]
01:00:00.106972 eth0  Out IP (tos 0x0, ttl 64, id 6516, offset 0, flags [DF], proto TCP (6), length 52)
    fv-az1720-213.5vs45zvnpbiehoyyevf2d3pjfe.cx.internal.cloudapp.net.54688 > 168.63.129.16.http: Flags [.], cksum 0x3401 (incorrect -> 0x856c), ack 2390, win 538, options [nop,nop,TS val 1701499890 ecr 1978746845], length 0
01:00:00.107146 eth0  Out IP (tos 0x0, ttl 64, id 6517, offset 0, flags [DF], proto TCP (6), length 52)
    fv-az1720-213.5vs45zvnpbiehoyyevf2d3pjfe.cx.internal.cloudapp.net.54688 > 168.63.129.16.http: Flags [F.], cksum 0x3401 (incorrect -> 0x856a), seq 201, ack 2390, win 538, options [nop,nop,TS val 1701499891 ecr 1978746845], length 0
01:00:00.107221 eth0  In  IP (tos 0x0, ttl 128, id 50879, offset 0, flags [DF], proto TCP (6), length 52)
    168.63.129.16.http > fv-az1720-213.5vs45zvnpbiehoyyevf2d3pjfe.cx.internal.cloudapp.net.54688: Flags [.], cksum 0x477f (correct), ack 202, win 16387, options [nop,nop,TS val 1978746847 ecr 1701499891], length 0
01:00:00.107580 eth0  Out IP (tos 0x0, ttl 64, id 45515, offset 0, flags [DF], proto TCP (6), length 60)
    fv-az1720-213.5vs45zvnpbiehoyyevf2d3pjfe.cx.internal.cloudapp.net.34602 > 168.63.129.16.32526: Flags [S], cksum 0x3409 (incorrect -> 0xee97), seq 3838576185, win 64240, options [mss 1460,sackOK,TS val 1701499891 ecr 0,nop,wscale 7], length 0
01:00:00.107781 eth0  In  IP (tos 0x0, ttl 128, id 50880, offset 0, flags [DF], proto TCP (6), length 60)
    168.63.129.16.32526 > fv-az1720-213.5vs45zvnpbiehoyyevf2d3pjfe.cx.internal.cloudapp.net.34602: Flags [S.], cksum 0xa593 (correct), seq 3181168756, ack 3838576186, win 65535, options [mss 1460,nop,wscale 8,sackOK,TS val 1978746848 ecr 1701499891], length 0
01:00:00.107800 eth0  Out IP (tos 0x0, ttl 64, id 45516, offset 0, flags [DF], proto TCP (6), length 52)
    fv-az1720-213.5vs45zvnpbiehoyyevf2d3pjfe.cx.internal.cloudapp.net.34602 > 168.63.129.16.32526: Flags [.], cksum 0x3401 (incorrect -> 0xd26a), ack 1, win 502, options [nop,nop,TS val 1701499891 ecr 1978746848], length 0
01:00:00.107819 eth0  Out IP (tos 0x0, ttl 64, id 45517, offset 0, flags [DF], proto TCP (6), length 507)
    fv-az1720-213.5vs45zvnpbiehoyyevf2d3pjfe.cx.internal.cloudapp.net.34602 > 168.63.129.16.32526: Flags [P.], cksum 0x35c8 (incorrect -> 0x5e09), seq 1:456, ack 1, win 502, options [nop,nop,TS val 1701499891 ecr 1978746848], length 455
01:00:00.110455 eth0  In  IP (tos 0x0, ttl 128, id 50881, offset 0, flags [DF], proto TCP (6), length 197)
    168.63.129.16.32526 > fv-az1720-213.5vs45zvnpbiehoyyevf2d3pjfe.cx.internal.cloudapp.net.34602: Flags [FP.], cksum 0x8ab4 (correct), seq 1:146, ack 456, win 16386, options [nop,nop,TS val 1978746848 ecr 1701499891], length 145
01:00:00.110580 eth0  Out IP (tos 0x0, ttl 64, id 45518, offset 0, flags [DF], proto TCP (6), length 52)
    fv-az1720-213.5vs45zvnpbiehoyyevf2d3pjfe.cx.internal.cloudapp.net.34602 > 168.63.129.16.32526: Flags [F.], cksum 0x3401 (incorrect -> 0xd00e), seq 456, ack 147, win 501, options [nop,nop,TS val 1701499894 ecr 1978746848], length 0
01:00:00.110681 eth0  In  IP (tos 0x0, ttl 128, id 50882, offset 0, flags [DF], proto TCP (6), length 52)
    168.63.129.16.32526 > fv-az1720-213.5vs45zvnpbiehoyyevf2d3pjfe.cx.internal.cloudapp.net.34602: Flags [.], cksum 0x91ff (correct), ack 457, win 16386, options [nop,nop,TS val 1978746850 ecr 1701499894], length 0
01:00:00.111159 eth0  Out IP (tos 0x0, ttl 64, id 62087, offset 0, flags [DF], proto TCP (6), length 60)
    fv-az1720-213.5vs45zvnpbiehoyyevf2d3pjfe.cx.internal.cloudapp.net.34618 > 168.63.129.16.32526: Flags [S], cksum 0x3409 (incorrect -> 0x0195), seq 2345094189, win 64240, options [mss 1460,sackOK,TS val 1701499895 ecr 0,nop,wscale 7], length 0
01:00:00.111344 eth0  In  IP (tos 0x0, ttl 128, id 50883, offset 0, flags [DF], proto TCP (6), length 60)
    168.63.129.16.32526 > fv-az1720-213.5vs45zvnpbiehoyyevf2d3pjfe.cx.internal.cloudapp.net.34618: Flags [S.], cksum 0xb018 (correct), seq 1238516916, ack 2345094190, win 65535, options [mss 1460,nop,wscale 8,sackOK,TS val 1978746851 ecr 1701499895], length 0
01:00:00.111365 eth0  Out IP (tos 0x0, ttl 64, id 62088, offset 0, flags [DF], proto TCP (6), length 52)
    fv-az1720-213.5vs45zvnpbiehoyyevf2d3pjfe.cx.internal.cloudapp.net.34618 > 168.63.129.16.32526: Flags [.], cksum 0x3401 (incorrect -> 0xdcef), ack 1, win 502, options [nop,nop,TS val 1701499895 ecr 1978746851], length 0
01:00:00.111382 eth0  Out IP (tos 0x0, ttl 64, id 62089, offset 0, flags [DF], proto TCP (6), length 454)
    fv-az1720-213.5vs45zvnpbiehoyyevf2d3pjfe.cx.internal.cloudapp.net.34618 > 168.63.129.16.32526: Flags [P.], cksum 0x3593 (incorrect -> 0x6c48), seq 1:403, ack 1, win 502, options [nop,nop,TS val 1701499895 ecr 1978746851], length 402
01:00:00.111393 eth0  Out IP (tos 0x0, ttl 64, id 62090, offset 0, flags [DF], proto TCP (6), length 642)
    fv-az1720-213.5vs45zvnpbiehoyyevf2d3pjfe.cx.internal.cloudapp.net.34618 > 168.63.129.16.32526: Flags [P.], cksum 0x364f (incorrect -> 0x72d4), seq 403:993, ack 1, win 502, options [nop,nop,TS val 1701499895 ecr 1978746851], length 590
01:00:00.111498 eth0  In  IP (tos 0x0, ttl 128, id 50884, offset 0, flags [DF], proto TCP (6), length 52)
    168.63.129.16.32526 > fv-az1720-213.5vs45zvnpbiehoyyevf2d3pjfe.cx.internal.cloudapp.net.34618: Flags [.], cksum 0x9b05 (correct), ack 993, win 16384, options [nop,nop,TS val 1978746851 ecr 1701499895], length 0
01:00:00.111807 eth0  In  IP (tos 0x0, ttl 128, id 50885, offset 0, flags [DF], proto TCP (6), length 206)
    168.63.129.16.32526 > fv-az1720-213.5vs45zvnpbiehoyyevf2d3pjfe.cx.internal.cloudapp.net.34618: Flags [FP.], cksum 0x98e2 (correct), seq 1:155, ack 993, win 16384, options [nop,nop,TS val 1978746852 ecr 1701499895], length 154
01:00:00.112111 eth0  Out IP (tos 0x0, ttl 64, id 60191, offset 0, flags [DF], proto TCP (6), length 60)
    fv-az1720-213.5vs45zvnpbiehoyyevf2d3pjfe.cx.internal.cloudapp.net.34634 > 168.63.129.16.32526: Flags [S], cksum 0x3409 (incorrect -> 0x9d44), seq 1545461782, win 64240, options [mss 1460,sackOK,TS val 1701499896 ecr 0,nop,wscale 7], length 0
01:00:00.112287 eth0  In  IP (tos 0x0, ttl 128, id 50886, offset 0, flags [DF], proto TCP (6), length 60)
    168.63.129.16.32526 > fv-az1720-213.5vs45zvnpbiehoyyevf2d3pjfe.cx.internal.cloudapp.net.34634: Flags [S.], cksum 0xe7c0 (correct), seq 1544984182, ack 1545461783, win 65535, options [mss 1460,nop,wscale 8,sackOK,TS val 1978746852 ecr 1701499896], length 0
01:00:00.112305 eth0  Out IP (tos 0x0, ttl 64, id 60192, offset 0, flags [DF], proto TCP (6), length 52)
    fv-az1720-213.5vs45zvnpbiehoyyevf2d3pjfe.cx.internal.cloudapp.net.34634 > 168.63.129.16.32526: Flags [.], cksum 0x3401 (incorrect -> 0x1498), ack 1, win 502, options [nop,nop,TS val 1701499896 ecr 1978746852], length 0
01:00:00.112322 eth0  Out IP (tos 0x0, ttl 64, id 60193, offset 0, flags [DF], proto TCP (6), length 455)
    fv-az1720-213.5vs45zvnpbiehoyyevf2d3pjfe.cx.internal.cloudapp.net.34634 > 168.63.129.16.32526: Flags [P.], cksum 0x3594 (incorrect -> 0x6af0), seq 1:404, ack 1, win 502, options [nop,nop,TS val 1701499896 ecr 1978746852], length 403
01:00:00.112333 eth0  Out IP (tos 0x0, ttl 64, id 60194, offset 0, flags [DF], proto TCP (6), length 2711)
    fv-az1720-213.5vs45zvnpbiehoyyevf2d3pjfe.cx.internal.cloudapp.net.34634 > 168.63.129.16.32526: Flags [P.], cksum 0x3e64 (incorrect -> 0x39b0), seq 404:3063, ack 1, win 502, options [nop,nop,TS val 1701499896 ecr 1978746852], length 2659
01:00:00.112488 eth0  In  IP (tos 0x0, ttl 128, id 50887, offset 0, flags [DF], proto TCP (6), length 52)
    168.63.129.16.32526 > fv-az1720-213.5vs45zvnpbiehoyyevf2d3pjfe.cx.internal.cloudapp.net.34634: Flags [.], cksum 0xca93 (correct), ack 3063, win 16388, options [nop,nop,TS val 1978746852 ecr 1701499896], length 0
01:00:00.112954 eth0  In  IP (tos 0x0, ttl 128, id 50888, offset 0, flags [DF], proto TCP (6), length 206)
    168.63.129.16.32526 > fv-az1720-213.5vs45zvnpbiehoyyevf2d3pjfe.cx.internal.cloudapp.net.34634: Flags [FP.], cksum 0xc871 (correct), seq 1:155, ack 3063, win 16388, options [nop,nop,TS val 1978746852 ecr 1701499896], length 154
01:00:00.113091 eth0  Out IP (tos 0x0, ttl 64, id 62091, offset 0, flags [DF], proto TCP (6), length 52)
    fv-az1720-213.5vs45zvnpbiehoyyevf2d3pjfe.cx.internal.cloudapp.net.34618 > 168.63.129.16.32526: Flags [F.], cksum 0x3401 (incorrect -> 0xd871), seq 993, ack 156, win 501, options [nop,nop,TS val 1701499897 ecr 1978746852], length 0
01:00:00.113110 eth0  Out IP (tos 0x0, ttl 64, id 60196, offset 0, flags [DF], proto TCP (6), length 52)
    fv-az1720-213.5vs45zvnpbiehoyyevf2d3pjfe.cx.internal.cloudapp.net.34634 > 168.63.129.16.32526: Flags [F.], cksum 0x3401 (incorrect -> 0x0806), seq 3063, ack 156, win 501, options [nop,nop,TS val 1701499897 ecr 1978746852], length 0
01:00:00.113170 eth0  In  IP (tos 0x0, ttl 128, id 50889, offset 0, flags [DF], proto TCP (6), length 52)
    168.63.129.16.32526 > fv-az1720-213.5vs45zvnpbiehoyyevf2d3pjfe.cx.internal.cloudapp.net.34618: Flags [.], cksum 0x9a65 (correct), ack 994, win 16384, options [nop,nop,TS val 1978746853 ecr 1701499897], length 0
01:00:00.113217 eth0  In  IP (tos 0x0, ttl 128, id 50890, offset 0, flags [DF], proto TCP (6), length 52)
    168.63.129.16.32526 > fv-az1720-213.5vs45zvnpbiehoyyevf2d3pjfe.cx.internal.cloudapp.net.34634: Flags [.], cksum 0xc9f5 (correct), ack 3064, win 16388, options [nop,nop,TS val 1978746853 ecr 1701499897], length 0
01:00:00.215662 eth0  Out IP (tos 0x0, ttl 64, id 1951, offset 0, flags [none], proto UDP (17), length 70)
    fv-az1720-213.5vs45zvnpbiehoyyevf2d3pjfe.cx.internal.cloudapp.net.38047 > 168.63.129.16.domain: 9165+ [1au] A? api.nuget.org. (42)
01:00:00.215755 eth0  Out IP (tos 0x0, ttl 64, id 57940, offset 0, flags [none], proto UDP (17), length 70)
    fv-az1720-213.5vs45zvnpbiehoyyevf2d3pjfe.cx.internal.cloudapp.net.40012 > 168.63.129.16.domain: 28782+ [1au] AAAA? api.nuget.org. (42)
01:00:00.217634 eth0  In  IP (tos 0x0, ttl 128, id 50891, offset 0, flags [none], proto UDP (17), length 314)
    168.63.129.16.domain > fv-az1720-213.5vs45zvnpbiehoyyevf2d3pjfe.cx.internal.cloudapp.net.40012: 28782 7/0/1 api.nuget.org. CNAME nugetapiprod.trafficmanager.net., nugetapiprod.trafficmanager.net. CNAME apiprod-mscdn.azureedge.net., apiprod-mscdn.azureedge.net. CNAME apiprod-mscdn.afd.azureedge.net., apiprod-mscdn.afd.azureedge.net. CNAME azureedge-t-prod.trafficmanager.net., azureedge-t-prod.trafficmanager.net. CNAME shed.dual-low.s-part-0013.t-0009.t-msedge.net., shed.dual-low.s-part-0013.t-0009.t-msedge.net. CNAME s-part-0013.t-0009.t-msedge.net., s-part-0013.t-0009.t-msedge.net. AAAA 2620:1ec:bdf::41 (286)
01:00:00.217676 eth0  In  IP (tos 0x0, ttl 128, id 50892, offset 0, flags [none], proto UDP (17), length 302)
    168.63.129.16.domain > fv-az1720-213.5vs45zvnpbiehoyyevf2d3pjfe.cx.internal.cloudapp.net.38047: 9165 7/0/1 api.nuget.org. CNAME nugetapiprod.trafficmanager.net., nugetapiprod.trafficmanager.net. CNAME apiprod-mscdn.azureedge.net., apiprod-mscdn.azureedge.net. CNAME apiprod-mscdn.afd.azureedge.net., apiprod-mscdn.afd.azureedge.net. CNAME azureedge-t-prod.trafficmanager.net., azureedge-t-prod.trafficmanager.net. CNAME shed.dual-low.s-part-0013.t-0009.t-msedge.net., shed.dual-low.s-part-0013.t-0009.t-msedge.net. CNAME s-part-0013.t-0009.t-msedge.net., s-part-0013.t-0009.t-msedge.net. A 13.107.246.41 (274)
01:00:00.218338 eth0  Out IP (tos 0x0, ttl 64, id 31449, offset 0, flags [DF], proto TCP (6), length 60)
    fv-az1720-213.5vs45zvnpbiehoyyevf2d3pjfe.cx.internal.cloudapp.net.57372 > 13.107.246.41.https: Flags [S], cksum 0x0e4e (incorrect -> 0x9966), seq 3563522013, win 64240, options [mss 1460,sackOK,TS val 1649902869 ecr 0,nop,wscale 7], length 0
01:00:00.219005 eth0  In  IP (tos 0x0, ttl 57, id 0, offset 0, flags [DF], proto TCP (6), length 60)
    13.107.246.41.https > fv-az1720-213.5vs45zvnpbiehoyyevf2d3pjfe.cx.internal.cloudapp.net.57372: Flags [S.], cksum 0xbedc (correct), seq 3004900981, ack 3563522014, win 43440, options [mss 1460,sackOK,TS val 4127087655 ecr 1649902869,nop,wscale 9], length 0
01:00:00.219023 eth0  Out IP (tos 0x0, ttl 64, id 31450, offset 0, flags [DF], proto TCP (6), length 52)
    fv-az1720-213.5vs45zvnpbiehoyyevf2d3pjfe.cx.internal.cloudapp.net.57372 > 13.107.246.41.https: Flags [.], cksum 0x0e46 (incorrect -> 0x9564), ack 1, win 502, options [nop,nop,TS val 1649902870 ecr 4127087655], length 0
01:00:00.219280 eth0  Out IP (tos 0x0, ttl 64, id 31451, offset 0, flags [DF], proto TCP (6), length 1527)
    fv-az1720-213.5vs45zvnpbiehoyyevf2d3pjfe.cx.internal.cloudapp.net.57372 > 13.107.246.41.https: Flags [P.], cksum 0x1409 (incorrect -> 0x3869), seq 1:1476, ack 1, win 502, options [nop,nop,TS val 1649902870 ecr 4127087655], length 1475
01:00:00.219744 eth0  In  IP (tos 0x0, ttl 57, id 13107, offset 0, flags [DF], proto TCP (6), length 52)
    13.107.246.41.https > fv-az1720-213.5vs45zvnpbiehoyyevf2d3pjfe.cx.internal.cloudapp.net.57372: Flags [.], cksum 0x9143 (correct), ack 1476, win 83, options [nop,nop,TS val 4127087656 ecr 1649902870], length 0
01:00:00.219987 eth0  In  IP (tos 0x0, ttl 57, id 13108, offset 0, flags [DF], proto TCP (6), length 151)
    13.107.246.41.https > fv-az1720-213.5vs45zvnpbiehoyyevf2d3pjfe.cx.internal.cloudapp.net.57372: Flags [P.], cksum 0x2f64 (correct), seq 1:100, ack 1476, win 83, options [nop,nop,TS val 4127087656 ecr 1649902870], length 99
01:00:00.220007 eth0  Out IP (tos 0x0, ttl 64, id 31453, offset 0, flags [DF], proto TCP (6), length 52)
    fv-az1720-213.5vs45zvnpbiehoyyevf2d3pjfe.cx.internal.cloudapp.net.57372 > 13.107.246.41.https: Flags [.], cksum 0x0e46 (incorrect -> 0x8f3c), ack 100, win 502, options [nop,nop,TS val 1649902871 ecr 4127087656], length 0
01:00:00.220059 eth0  Out IP (tos 0x0, ttl 64, id 31454, offset 0, flags [DF], proto TCP (6), length 58)
    fv-az1720-213.5vs45zvnpbiehoyyevf2d3pjfe.cx.internal.cloudapp.net.57372 > 13.107.246.41.https: Flags [P.], cksum 0x0e4c (incorrect -> 0x772a), seq 1476:1482, ack 100, win 502, options [nop,nop,TS val 1649902871 ecr 4127087656], length 6
01:00:00.220100 eth0  Out IP (tos 0x0, ttl 64, id 31455, offset 0, flags [DF], proto TCP (6), length 340)
    fv-az1720-213.5vs45zvnpbiehoyyevf2d3pjfe.cx.internal.cloudapp.net.57372 > 13.107.246.41.https: Flags [P.], cksum 0x0f66 (incorrect -> 0xa5db), seq 1482:1770, ack 100, win 502, options [nop,nop,TS val 1649902871 ecr 4127087656], length 288
01:00:00.220606 eth0  In  IP (tos 0x0, ttl 57, id 13109, offset 0, flags [DF], proto TCP (6), length 52)
    13.107.246.41.https > fv-az1720-213.5vs45zvnpbiehoyyevf2d3pjfe.cx.internal.cloudapp.net.57372: Flags [.], cksum 0x8fb8 (correct), ack 1770, win 83, options [nop,nop,TS val 4127087657 ecr 1649902871], length 0
01:00:00.221170 eth0  In  IP (tos 0x0, ttl 57, id 13110, offset 0, flags [DF], proto TCP (6), length 4148)
    13.107.246.41.https > fv-az1720-213.5vs45zvnpbiehoyyevf2d3pjfe.cx.internal.cloudapp.net.57372: Flags [P.], cksum 0x1e46 (incorrect -> 0x14bb), seq 100:4196, ack 1770, win 83, options [nop,nop,TS val 4127087657 ecr 1649902871], length 4096
01:00:00.221182 eth0  Out IP (tos 0x0, ttl 64, id 31456, offset 0, flags [DF], proto TCP (6), length 52)
    fv-az1720-213.5vs45zvnpbiehoyyevf2d3pjfe.cx.internal.cloudapp.net.57372 > 13.107.246.41.https: Flags [.], cksum 0x0e46 (incorrect -> 0x7dd5), ack 4196, win 565, options [nop,nop,TS val 1649902872 ecr 4127087657], length 0
01:00:00.222126 eth0  In  IP (tos 0x0, ttl 57, id 13113, offset 0, flags [DF], proto TCP (6), length 2908)
    13.107.246.41.https > fv-az1720-213.5vs45zvnpbiehoyyevf2d3pjfe.cx.internal.cloudapp.net.57372: Flags [.], cksum 0x196e (incorrect -> 0xae90), seq 4196:7052, ack 1770, win 83, options [nop,nop,TS val 4127087658 ecr 1649902872], length 2856
01:00:00.222140 eth0  Out IP (tos 0x0, ttl 64, id 31457, offset 0, flags [DF], proto TCP (6), length 52)
    fv-az1720-213.5vs45zvnpbiehoyyevf2d3pjfe.cx.internal.cloudapp.net.57372 > 13.107.246.41.https: Flags [.], cksum 0x0e46 (incorrect -> 0x727e), ack 7052, win 610, options [nop,nop,TS val 1649902873 ecr 4127087658], length 0
01:00:00.222147 eth0  In  IP (tos 0x0, ttl 57, id 13115, offset 0, flags [DF], proto TCP (6), length 89)
    13.107.246.41.https > fv-az1720-213.5vs45zvnpbiehoyyevf2d3pjfe.cx.internal.cloudapp.net.57372: Flags [P.], cksum 0x725b (correct), seq 7052:7089, ack 1770, win 83, options [nop,nop,TS val 4127087658 ecr 1649902872], length 37
01:00:00.222335 eth0  Out IP (tos 0x0, ttl 64, id 31458, offset 0, flags [DF], proto TCP (6), length 126)
    fv-az1720-213.5vs45zvnpbiehoyyevf2d3pjfe.cx.internal.cloudapp.net.57372 > 13.107.246.41.https: Flags [P.], cksum 0x0e90 (incorrect -> 0xb241), seq 1770:1844, ack 7089, win 610, options [nop,nop,TS val 1649902873 ecr 4127087658], length 74
01:00:00.222388 eth0  Out IP (tos 0x0, ttl 64, id 31459, offset 0, flags [DF], proto TCP (6), length 273)
    fv-az1720-213.5vs45zvnpbiehoyyevf2d3pjfe.cx.internal.cloudapp.net.57372 > 13.107.246.41.https: Flags [P.], cksum 0x0f23 (incorrect -> 0x5e74), seq 1844:2065, ack 7089, win 610, options [nop,nop,TS val 1649902873 ecr 4127087658], length 221
01:00:00.223201 eth0  In  IP (tos 0x0, ttl 57, id 13116, offset 0, flags [DF], proto TCP (6), length 52)
    13.107.246.41.https > fv-az1720-213.5vs45zvnpbiehoyyevf2d3pjfe.cx.internal.cloudapp.net.57372: Flags [.], cksum 0x7340 (correct), ack 2065, win 83, options [nop,nop,TS val 4127087659 ecr 1649902873], length 0
01:00:00.223371 eth0  In  IP (tos 0x0, ttl 57, id 13117, offset 0, flags [DF], proto TCP (6), length 339)
    13.107.246.41.https > fv-az1720-213.5vs45zvnpbiehoyyevf2d3pjfe.cx.internal.cloudapp.net.57372: Flags [P.], cksum 0x9c0c (correct), seq 7089:7376, ack 2065, win 83, options [nop,nop,TS val 4127087659 ecr 1649902873], length 287
01:00:00.223496 eth0  In  IP (tos 0x0, ttl 57, id 13118, offset 0, flags [DF], proto TCP (6), length 339)
    13.107.246.41.https > fv-az1720-213.5vs45zvnpbiehoyyevf2d3pjfe.cx.internal.cloudapp.net.57372: Flags [P.], cksum 0x621b (correct), seq 7376:7663, ack 2065, win 83, options [nop,nop,TS val 4127087660 ecr 1649902873], length 287
01:00:00.223514 eth0  Out IP (tos 0x0, ttl 64, id 31460, offset 0, flags [DF], proto TCP (6), length 52)
    fv-az1720-213.5vs45zvnpbiehoyyevf2d3pjfe.cx.internal.cloudapp.net.57372 > 13.107.246.41.https: Flags [.], cksum 0x0e46 (incorrect -> 0x6ec6), ack 7663, win 654, options [nop,nop,TS val 1649902874 ecr 4127087659], length 0
01:00:00.225694 eth0  In  IP (tos 0x0, ttl 57, id 13119, offset 0, flags [DF], proto TCP (6), length 2386)
    13.107.246.41.https > fv-az1720-213.5vs45zvnpbiehoyyevf2d3pjfe.cx.internal.cloudapp.net.57372: Flags [P.], cksum 0x1764 (incorrect -> 0xaf4a), seq 7663:9997, ack 2065, win 83, options [nop,nop,TS val 4127087662 ecr 1649902874], length 2334
01:00:00.225703 eth0  Out IP (tos 0x0, ttl 64, id 31461, offset 0, flags [DF], proto TCP (6), length 52)
    fv-az1720-213.5vs45zvnpbiehoyyevf2d3pjfe.cx.internal.cloudapp.net.57372 > 13.107.246.41.https: Flags [.], cksum 0x0e46 (incorrect -> 0x657e), ack 9997, win 691, options [nop,nop,TS val 1649902876 ecr 4127087662], length 0
01:00:00.422464 eth0  Out IP (tos 0x0, ttl 64, id 31462, offset 0, flags [DF], proto TCP (6), length 322)
    fv-az1720-213.5vs45zvnpbiehoyyevf2d3pjfe.cx.internal.cloudapp.net.57372 > 13.107.246.41.https: Flags [P.], cksum 0x0f54 (incorrect -> 0xe68e), seq 2065:2335, ack 9997, win 691, options [nop,nop,TS val 1649903073 ecr 4127087662], length 270
01:00:00.454430 eth0  In  IP (tos 0x0, ttl 57, id 13121, offset 0, flags [DF], proto TCP (6), length 3396)
    13.107.246.41.https > fv-az1720-213.5vs45zvnpbiehoyyevf2d3pjfe.cx.internal.cloudapp.net.57372: Flags [P.], cksum 0x1b56 (incorrect -> 0x780f), seq 9997:13341, ack 2335, win 83, options [nop,nop,TS val 4127087890 ecr 1649903073], length 3344
01:00:00.454477 eth0  Out IP (tos 0x0, ttl 64, id 31463, offset 0, flags [DF], proto TCP (6), length 52)
    fv-az1720-213.5vs45zvnpbiehoyyevf2d3pjfe.cx.internal.cloudapp.net.57372 > 13.107.246.41.https: Flags [.], cksum 0x0e46 (incorrect -> 0x5596), ack 13341, win 692, options [nop,nop,TS val 1649903105 ecr 4127087890], length 0
01:00:06.113796 eth0  Out IP (tos 0x0, ttl 64, id 38190, offset 0, flags [DF], proto TCP (6), length 60)
    fv-az1720-213.5vs45zvnpbiehoyyevf2d3pjfe.cx.internal.cloudapp.net.51476 > 168.63.129.16.http: Flags [S], cksum 0x3409 (incorrect -> 0x6675), seq 3339374971, win 64240, options [mss 1460,sackOK,TS val 1701505897 ecr 0,nop,wscale 7], length 0
01:00:06.114122 eth0  In  IP (tos 0x0, ttl 128, id 50893, offset 0, flags [DF], proto TCP (6), length 60)
    168.63.129.16.http > fv-az1720-213.5vs45zvnpbiehoyyevf2d3pjfe.cx.internal.cloudapp.net.51476: Flags [S.], cksum 0x5b37 (correct), seq 2680721676, ack 3339374972, win 65535, options [mss 1460,nop,wscale 8,sackOK,TS val 1978752854 ecr 1701505897], length 0
01:00:06.114166 eth0  Out IP (tos 0x0, ttl 64, id 38191, offset 0, flags [DF], proto TCP (6), length 52)
    fv-az1720-213.5vs45zvnpbiehoyyevf2d3pjfe.cx.internal.cloudapp.net.51476 > 168.63.129.16.http: Flags [.], cksum 0x3401 (incorrect -> 0x880d), ack 1, win 502, options [nop,nop,TS val 1701505898 ecr 1978752854], length 0
01:00:06.114212 eth0  Out IP (tos 0x0, ttl 64, id 38192, offset 0, flags [DF], proto TCP (6), length 252)
    fv-az1720-213.5vs45zvnpbiehoyyevf2d3pjfe.cx.internal.cloudapp.net.51476 > 168.63.129.16.http: Flags [P.], cksum 0x34c9 (incorrect -> 0x97ae), seq 1:201, ack 1, win 502, options [nop,nop,TS val 1701505898 ecr 1978752854], length 200: HTTP, length: 200
	GET /machine/?comp=goalstate HTTP/1.1
	Host: 168.63.129.16
	Accept-Encoding: identity
	x-ms-agent-name: WALinuxAgent
	x-ms-version: 2012-11-30
	Connection: close
	User-Agent: WALinuxAgent/2.13.1.1
	
01:00:06.116056 eth0  In  IP (tos 0x0, ttl 128, id 18126, offset 0, flags [DF], proto TCP (6), length 2440)
    168.63.129.16.http > fv-az1720-213.5vs45zvnpbiehoyyevf2d3pjfe.cx.internal.cloudapp.net.51476: Flags [FP.], cksum 0x3d55 (incorrect -> 0x77f3), seq 1:2389, ack 201, win 16387, options [nop,nop,TS val 1978752856 ecr 1701505898], length 2388: HTTP, length: 2388
	HTTP/1.1 200 OK
	Content-Type: text/xml; charset=utf-8
	Server: Microsoft-IIS/10.0
	Date: Sat, 24 May 2025 01:00:06 GMT
	Connection: close
	Content-Length: 2224
	
	<?xml version="1.0" encoding="utf-8"?>
	<GoalState xmlns:xsi="http://www.w3.org/2001/XMLSchema-instance" xsi:noNamespaceSchemaLocation="goalstate10.xsd">
	  <Version>2012-11-30</Version>
	  <Incarnation>1</Incarnation>
	  <Machine>
	    <ExpectedState>Started</ExpectedState>
	    <StopRolesDeadlineHint>300000</StopRolesDeadlineHint>
	    <LBProbePorts>
	      <Port>16001</Port>
	    </LBProbePorts>
	    <ExpectHealthReport>FALSE</ExpectHealthReport>
	  </Machine>
	  <Container>
	    <ContainerId>53011767-77ae-4b65-b198-2f2f03dae266</ContainerId>
	    <RoleInstanceList>
	      <RoleInstance>
	        <InstanceId>f50e4b26-82ca-4d1e-bb16-7167849ca85d._EUS2-GCUS1U24J110J51-0073</InstanceId>
	        <State>Started</State>
	        <Configuration>
	          <HostingEnvironmentConfig>http://168.63.129.16:80/machine/53011767-77ae-4b65-b198-2f2f03dae266/f50e4b26%2D82ca%2D4d1e%2Dbb16%2D7167849ca85d.%5FEUS2%2DGCUS1U24J110J51%2D0073?comp=config&amp;type=hostingEnvironmentConfig&amp;incarnation=1</HostingEnvironmentConfig>
	          <SharedConfig>http://168.63.129.16:80/machine/53011767-77ae-4b65-b198-2f2f03dae266/f50e4b26%2D82ca%2D4d1e%2Dbb16%2D7167849ca85d.%5FEUS2%2DGCUS1U24J110J51%2D0073?comp=config&amp;type=sharedConfig&amp;incarnation=1</SharedConfig>
	          <ExtensionsConfig>http://168.63.129.16:80/machine/53011767-77ae-4b65-b198-2f2f03dae266/f50e4b26%2D82ca%2D4d1e%2Dbb16%2D7167849ca85d.%5FEUS2%2DGCUS1U24J110J51%2D0073?comp=config&amp;type=extensionsConfig&amp;incarnation=1</ExtensionsConfig>
	          <FullConfig>http://168.63.129.16:80/machine/53011767-77ae-4b65-b198-2f2f03dae266/f50e4b26%2D82ca%2D4d1e%2Dbb16%2D7167849ca85d.%5FEUS2%2DGCUS1U24J110J51%2D0073?comp=config&amp;type=fullConfig&amp;incarnation=1</FullConfig>
	          <Certificates>http://168.63.129.16:80/machine/53011767-77ae-4b65-b198-2f2f03dae266/f50e4b26%2D82ca%2D4d1e%2Dbb16%2D7167849ca85d.%5FEUS2%2DGCUS1U24J110J51%2D0073?comp=certificates&amp;incarnation=1</Certificates>
	          <ConfigName>f50e4b26-82ca-4d1e-bb16-7167849ca85d.1.f50e4b26-82ca-4d1e-bb16-7167849ca85d.1._EUS2-GCUS1U24J110J51-0073.1.xml</ConfigName>
	        </Configuration>
	      </RoleInstance>
	    </RoleInstanceList>
	  </Container>
	</GoalState> [|http]
01:00:06.116081 eth0  Out IP (tos 0x0, ttl 64, id 38193, offset 0, flags [DF], proto TCP (6), length 52)
    fv-az1720-213.5vs45zvnpbiehoyyevf2d3pjfe.cx.internal.cloudapp.net.51476 > 168.63.129.16.http: Flags [.], cksum 0x3401 (incorrect -> 0x7dc8), ack 2390, win 538, options [nop,nop,TS val 1701505900 ecr 1978752856], length 0
01:00:06.116256 eth0  Out IP (tos 0x0, ttl 64, id 38194, offset 0, flags [DF], proto TCP (6), length 52)
    fv-az1720-213.5vs45zvnpbiehoyyevf2d3pjfe.cx.internal.cloudapp.net.51476 > 168.63.129.16.http: Flags [F.], cksum 0x3401 (incorrect -> 0x7dc7), seq 201, ack 2390, win 538, options [nop,nop,TS val 1701505900 ecr 1978752856], length 0
01:00:06.116344 eth0  In  IP (tos 0x0, ttl 128, id 50896, offset 0, flags [DF], proto TCP (6), length 52)
    168.63.129.16.http > fv-az1720-213.5vs45zvnpbiehoyyevf2d3pjfe.cx.internal.cloudapp.net.51476: Flags [.], cksum 0x3fde (correct), ack 202, win 16387, options [nop,nop,TS val 1978752856 ecr 1701505900], length 0
01:00:06.116681 eth0  Out IP (tos 0x0, ttl 64, id 7181, offset 0, flags [DF], proto TCP (6), length 60)
    fv-az1720-213.5vs45zvnpbiehoyyevf2d3pjfe.cx.internal.cloudapp.net.53374 > 168.63.129.16.32526: Flags [S], cksum 0x3409 (incorrect -> 0xedce), seq 3015759680, win 64240, options [mss 1460,sackOK,TS val 1701505900 ecr 0,nop,wscale 7], length 0
01:00:06.116880 eth0  In  IP (tos 0x0, ttl 128, id 50897, offset 0, flags [DF], proto TCP (6), length 60)
    168.63.129.16.32526 > fv-az1720-213.5vs45zvnpbiehoyyevf2d3pjfe.cx.internal.cloudapp.net.53374: Flags [S.], cksum 0xc634 (correct), seq 809573613, ack 3015759681, win 65535, options [mss 1460,nop,wscale 8,sackOK,TS val 1978752857 ecr 1701505900], length 0
01:00:06.116894 eth0  Out IP (tos 0x0, ttl 64, id 7182, offset 0, flags [DF], proto TCP (6), length 52)
    fv-az1720-213.5vs45zvnpbiehoyyevf2d3pjfe.cx.internal.cloudapp.net.53374 > 168.63.129.16.32526: Flags [.], cksum 0x3401 (incorrect -> 0xf30b), ack 1, win 502, options [nop,nop,TS val 1701505900 ecr 1978752857], length 0
01:00:06.116913 eth0  Out IP (tos 0x0, ttl 64, id 7183, offset 0, flags [DF], proto TCP (6), length 507)
    fv-az1720-213.5vs45zvnpbiehoyyevf2d3pjfe.cx.internal.cloudapp.net.53374 > 168.63.129.16.32526: Flags [P.], cksum 0x35c8 (incorrect -> 0x25de), seq 1:456, ack 1, win 502, options [nop,nop,TS val 1701505900 ecr 1978752857], length 455
01:00:06.120668 eth0  In  IP (tos 0x0, ttl 128, id 50898, offset 0, flags [DF], proto TCP (6), length 197)
    168.63.129.16.32526 > fv-az1720-213.5vs45zvnpbiehoyyevf2d3pjfe.cx.internal.cloudapp.net.53374: Flags [FP.], cksum 0xb95b (correct), seq 1:146, ack 456, win 16386, options [nop,nop,TS val 1978752858 ecr 1701505900], length 145
01:00:06.120789 eth0  Out IP (tos 0x0, ttl 64, id 7184, offset 0, flags [DF], proto TCP (6), length 52)
    fv-az1720-213.5vs45zvnpbiehoyyevf2d3pjfe.cx.internal.cloudapp.net.53374 > 168.63.129.16.32526: Flags [F.], cksum 0x3401 (incorrect -> 0xf0ad), seq 456, ack 147, win 501, options [nop,nop,TS val 1701505904 ecr 1978752858], length 0
01:00:06.120888 eth0  In  IP (tos 0x0, ttl 128, id 50899, offset 0, flags [DF], proto TCP (6), length 52)
    168.63.129.16.32526 > fv-az1720-213.5vs45zvnpbiehoyyevf2d3pjfe.cx.internal.cloudapp.net.53374: Flags [.], cksum 0xb29d (correct), ack 457, win 16386, options [nop,nop,TS val 1978752861 ecr 1701505904], length 0
01:00:06.121394 eth0  Out IP (tos 0x0, ttl 64, id 63253, offset 0, flags [DF], proto TCP (6), length 60)
    fv-az1720-213.5vs45zvnpbiehoyyevf2d3pjfe.cx.internal.cloudapp.net.53388 > 168.63.129.16.32526: Flags [S], cksum 0x3409 (incorrect -> 0xd10a), seq 2667645105, win 64240, options [mss 1460,sackOK,TS val 1701505905 ecr 0,nop,wscale 7], length 0
01:00:06.121657 eth0  In  IP (tos 0x0, ttl 128, id 50900, offset 0, flags [DF], proto TCP (6), length 60)
    168.63.129.16.32526 > fv-az1720-213.5vs45zvnpbiehoyyevf2d3pjfe.cx.internal.cloudapp.net.53388: Flags [S.], cksum 0x9cc4 (correct), seq 337266108, ack 2667645106, win 65535, options [mss 1460,nop,wscale 8,sackOK,TS val 1978752861 ecr 1701505905], length 0
01:00:06.121680 eth0  Out IP (tos 0x0, ttl 64, id 63254, offset 0, flags [DF], proto TCP (6), length 52)
    fv-az1720-213.5vs45zvnpbiehoyyevf2d3pjfe.cx.internal.cloudapp.net.53388 > 168.63.129.16.32526: Flags [.], cksum 0x3401 (incorrect -> 0xc99b), ack 1, win 502, options [nop,nop,TS val 1701505905 ecr 1978752861], length 0
01:00:06.121697 eth0  Out IP (tos 0x0, ttl 64, id 63255, offset 0, flags [DF], proto TCP (6), length 454)
    fv-az1720-213.5vs45zvnpbiehoyyevf2d3pjfe.cx.internal.cloudapp.net.53388 > 168.63.129.16.32526: Flags [P.], cksum 0x3593 (incorrect -> 0x58f4), seq 1:403, ack 1, win 502, options [nop,nop,TS val 1701505905 ecr 1978752861], length 402
01:00:06.121707 eth0  Out IP (tos 0x0, ttl 64, id 63256, offset 0, flags [DF], proto TCP (6), length 642)
    fv-az1720-213.5vs45zvnpbiehoyyevf2d3pjfe.cx.internal.cloudapp.net.53388 > 168.63.129.16.32526: Flags [P.], cksum 0x364f (incorrect -> 0x5f7a), seq 403:993, ack 1, win 502, options [nop,nop,TS val 1701505905 ecr 1978752861], length 590
01:00:06.121792 eth0  In  IP (tos 0x0, ttl 128, id 50901, offset 0, flags [DF], proto TCP (6), length 52)
    168.63.129.16.32526 > fv-az1720-213.5vs45zvnpbiehoyyevf2d3pjfe.cx.internal.cloudapp.net.53388: Flags [.], cksum 0x87b0 (correct), ack 993, win 16384, options [nop,nop,TS val 1978752862 ecr 1701505905], length 0
01:00:06.122184 eth0  In  IP (tos 0x0, ttl 128, id 50902, offset 0, flags [DF], proto TCP (6), length 206)
    168.63.129.16.32526 > fv-az1720-213.5vs45zvnpbiehoyyevf2d3pjfe.cx.internal.cloudapp.net.53388: Flags [FP.], cksum 0x9395 (correct), seq 1:155, ack 993, win 16384, options [nop,nop,TS val 1978752862 ecr 1701505905], length 154
01:00:06.122457 eth0  Out IP (tos 0x0, ttl 64, id 25598, offset 0, flags [DF], proto TCP (6), length 60)
    fv-az1720-213.5vs45zvnpbiehoyyevf2d3pjfe.cx.internal.cloudapp.net.53398 > 168.63.129.16.32526: Flags [S], cksum 0x3409 (incorrect -> 0x0eb4), seq 437080049, win 64240, options [mss 1460,sackOK,TS val 1701505906 ecr 0,nop,wscale 7], length 0
01:00:06.122644 eth0  In  IP (tos 0x0, ttl 128, id 50903, offset 0, flags [DF], proto TCP (6), length 60)
    168.63.129.16.32526 > fv-az1720-213.5vs45zvnpbiehoyyevf2d3pjfe.cx.internal.cloudapp.net.53398: Flags [S.], cksum 0x917f (correct), seq 2732851167, ack 437080050, win 65535, options [mss 1460,nop,wscale 8,sackOK,TS val 1978752862 ecr 1701505906], length 0
01:00:06.122665 eth0  Out IP (tos 0x0, ttl 64, id 25599, offset 0, flags [DF], proto TCP (6), length 52)
    fv-az1720-213.5vs45zvnpbiehoyyevf2d3pjfe.cx.internal.cloudapp.net.53398 > 168.63.129.16.32526: Flags [.], cksum 0x3401 (incorrect -> 0xbe56), ack 1, win 502, options [nop,nop,TS val 1701505906 ecr 1978752862], length 0
01:00:06.122680 eth0  Out IP (tos 0x0, ttl 64, id 25600, offset 0, flags [DF], proto TCP (6), length 455)
    fv-az1720-213.5vs45zvnpbiehoyyevf2d3pjfe.cx.internal.cloudapp.net.53398 > 168.63.129.16.32526: Flags [P.], cksum 0x3594 (incorrect -> 0x14af), seq 1:404, ack 1, win 502, options [nop,nop,TS val 1701505906 ecr 1978752862], length 403
01:00:06.122690 eth0  Out IP (tos 0x0, ttl 64, id 25601, offset 0, flags [DF], proto TCP (6), length 2711)
    fv-az1720-213.5vs45zvnpbiehoyyevf2d3pjfe.cx.internal.cloudapp.net.53398 > 168.63.129.16.32526: Flags [P.], cksum 0x3e64 (incorrect -> 0x0268), seq 404:3063, ack 1, win 502, options [nop,nop,TS val 1701505906 ecr 1978752862], length 2659
01:00:06.122769 eth0  In  IP (tos 0x0, ttl 128, id 50904, offset 0, flags [DF], proto TCP (6), length 52)
    168.63.129.16.32526 > fv-az1720-213.5vs45zvnpbiehoyyevf2d3pjfe.cx.internal.cloudapp.net.53398: Flags [.], cksum 0x7451 (correct), ack 3063, win 16388, options [nop,nop,TS val 1978752863 ecr 1701505906], length 0
01:00:06.123310 eth0  In  IP (tos 0x0, ttl 128, id 50905, offset 0, flags [DF], proto TCP (6), length 206)
    168.63.129.16.32526 > fv-az1720-213.5vs45zvnpbiehoyyevf2d3pjfe.cx.internal.cloudapp.net.53398: Flags [FP.], cksum 0x8036 (correct), seq 1:155, ack 3063, win 16388, options [nop,nop,TS val 1978752863 ecr 1701505906], length 154
01:00:06.123428 eth0  Out IP (tos 0x0, ttl 64, id 63257, offset 0, flags [DF], proto TCP (6), length 52)
    fv-az1720-213.5vs45zvnpbiehoyyevf2d3pjfe.cx.internal.cloudapp.net.53388 > 168.63.129.16.32526: Flags [F.], cksum 0x3401 (incorrect -> 0xc51d), seq 993, ack 156, win 501, options [nop,nop,TS val 1701505907 ecr 1978752862], length 0
01:00:06.123447 eth0  Out IP (tos 0x0, ttl 64, id 25603, offset 0, flags [DF], proto TCP (6), length 52)
    fv-az1720-213.5vs45zvnpbiehoyyevf2d3pjfe.cx.internal.cloudapp.net.53398 > 168.63.129.16.32526: Flags [F.], cksum 0x3401 (incorrect -> 0xb1c3), seq 3063, ack 156, win 501, options [nop,nop,TS val 1701505907 ecr 1978752863], length 0
01:00:06.123519 eth0  In  IP (tos 0x0, ttl 128, id 50907, offset 0, flags [DF], proto TCP (6), length 52)
    168.63.129.16.32526 > fv-az1720-213.5vs45zvnpbiehoyyevf2d3pjfe.cx.internal.cloudapp.net.53398: Flags [.], cksum 0x73b4 (correct), ack 3064, win 16388, options [nop,nop,TS val 1978752863 ecr 1701505907], length 0
01:00:06.123518 eth0  In  IP (tos 0x0, ttl 128, id 50906, offset 0, flags [DF], proto TCP (6), length 52)
    168.63.129.16.32526 > fv-az1720-213.5vs45zvnpbiehoyyevf2d3pjfe.cx.internal.cloudapp.net.53388: Flags [.], cksum 0x8711 (correct), ack 994, win 16384, options [nop,nop,TS val 1978752863 ecr 1701505907], length 0
01:00:07.237058 eth0  Out IP (tos 0x0, ttl 64, id 11152, offset 0, flags [DF], proto TCP (6), length 60)
    fv-az1720-213.5vs45zvnpbiehoyyevf2d3pjfe.cx.internal.cloudapp.net.51482 > 168.63.129.16.http: Flags [S], cksum 0x3409 (incorrect -> 0x9f44), seq 2309673378, win 64240, options [mss 1460,sackOK,TS val 1701507021 ecr 0,nop,wscale 7], length 0
01:00:07.237306 eth0  In  IP (tos 0x0, ttl 128, id 50908, offset 0, flags [DF], proto TCP (6), length 60)
    168.63.129.16.http > fv-az1720-213.5vs45zvnpbiehoyyevf2d3pjfe.cx.internal.cloudapp.net.51482: Flags [S.], cksum 0x23d5 (correct), seq 2878796044, ack 2309673379, win 65535, options [mss 1460,nop,wscale 8,sackOK,TS val 1978753977 ecr 1701507021], length 0
01:00:07.237328 eth0  Out IP (tos 0x0, ttl 64, id 11153, offset 0, flags [DF], proto TCP (6), length 52)
    fv-az1720-213.5vs45zvnpbiehoyyevf2d3pjfe.cx.internal.cloudapp.net.51482 > 168.63.129.16.http: Flags [.], cksum 0x3401 (incorrect -> 0x50ac), ack 1, win 502, options [nop,nop,TS val 1701507021 ecr 1978753977], length 0
01:00:07.237355 eth0  Out IP (tos 0x0, ttl 64, id 11154, offset 0, flags [DF], proto TCP (6), length 252)
    fv-az1720-213.5vs45zvnpbiehoyyevf2d3pjfe.cx.internal.cloudapp.net.51482 > 168.63.129.16.http: Flags [P.], cksum 0x34c9 (incorrect -> 0x604d), seq 1:201, ack 1, win 502, options [nop,nop,TS val 1701507021 ecr 1978753977], length 200: HTTP, length: 200
	GET /machine/?comp=goalstate HTTP/1.1
	Host: 168.63.129.16
	Accept-Encoding: identity
	x-ms-agent-name: WALinuxAgent
	x-ms-version: 2012-11-30
	Connection: close
	User-Agent: WALinuxAgent/2.13.1.1
	
01:00:07.238634 eth0  In  IP (tos 0x0, ttl 128, id 18141, offset 0, flags [DF], proto TCP (6), length 2440)
    168.63.129.16.http > fv-az1720-213.5vs45zvnpbiehoyyevf2d3pjfe.cx.internal.cloudapp.net.51482: Flags [FP.], cksum 0x3d55 (incorrect -> 0x3f93), seq 1:2389, ack 201, win 16387, options [nop,nop,TS val 1978753978 ecr 1701507021], length 2388: HTTP, length: 2388
	HTTP/1.1 200 OK
	Content-Type: text/xml; charset=utf-8
	Server: Microsoft-IIS/10.0
	Date: Sat, 24 May 2025 01:00:07 GMT
	Connection: close
	Content-Length: 2224
	
	<?xml version="1.0" encoding="utf-8"?>
	<GoalState xmlns:xsi="http://www.w3.org/2001/XMLSchema-instance" xsi:noNamespaceSchemaLocation="goalstate10.xsd">
	  <Version>2012-11-30</Version>
	  <Incarnation>1</Incarnation>
	  <Machine>
	    <ExpectedState>Started</ExpectedState>
	    <StopRolesDeadlineHint>300000</StopRolesDeadlineHint>
	    <LBProbePorts>
	      <Port>16001</Port>
	    </LBProbePorts>
	    <ExpectHealthReport>FALSE</ExpectHealthReport>
	  </Machine>
	  <Container>
	    <ContainerId>53011767-77ae-4b65-b198-2f2f03dae266</ContainerId>
	    <RoleInstanceList>
	      <RoleInstance>
	        <InstanceId>f50e4b26-82ca-4d1e-bb16-7167849ca85d._EUS2-GCUS1U24J110J51-0073</InstanceId>
	        <State>Started</State>
	        <Configuration>
	          <HostingEnvironmentConfig>http://168.63.129.16:80/machine/53011767-77ae-4b65-b198-2f2f03dae266/f50e4b26%2D82ca%2D4d1e%2Dbb16%2D7167849ca85d.%5FEUS2%2DGCUS1U24J110J51%2D0073?comp=config&amp;type=hostingEnvironmentConfig&amp;incarnation=1</HostingEnvironmentConfig>
	          <SharedConfig>http://168.63.129.16:80/machine/53011767-77ae-4b65-b198-2f2f03dae266/f50e4b26%2D82ca%2D4d1e%2Dbb16%2D7167849ca85d.%5FEUS2%2DGCUS1U24J110J51%2D0073?comp=config&amp;type=sharedConfig&amp;incarnation=1</SharedConfig>
	          <ExtensionsConfig>http://168.63.129.16:80/machine/53011767-77ae-4b65-b198-2f2f03dae266/f50e4b26%2D82ca%2D4d1e%2Dbb16%2D7167849ca85d.%5FEUS2%2DGCUS1U24J110J51%2D0073?comp=config&amp;type=extensionsConfig&amp;incarnation=1</ExtensionsConfig>
	          <FullConfig>http://168.63.129.16:80/machine/53011767-77ae-4b65-b198-2f2f03dae266/f50e4b26%2D82ca%2D4d1e%2Dbb16%2D7167849ca85d.%5FEUS2%2DGCUS1U24J110J51%2D0073?comp=config&amp;type=fullConfig&amp;incarnation=1</FullConfig>
	          <Certificates>http://168.63.129.16:80/machine/53011767-77ae-4b65-b198-2f2f03dae266/f50e4b26%2D82ca%2D4d1e%2Dbb16%2D7167849ca85d.%5FEUS2%2DGCUS1U24J110J51%2D0073?comp=certificates&amp;incarnation=1</Certificates>
	          <ConfigName>f50e4b26-82ca-4d1e-bb16-7167849ca85d.1.f50e4b26-82ca-4d1e-bb16-7167849ca85d.1._EUS2-GCUS1U24J110J51-0073.1.xml</ConfigName>
	        </Configuration>
	      </RoleInstance>
	    </RoleInstanceList>
	  </Container>
	</GoalState> [|http]
01:00:07.238649 eth0  Out IP (tos 0x0, ttl 64, id 11155, offset 0, flags [DF], proto TCP (6), length 52)
    fv-az1720-213.5vs45zvnpbiehoyyevf2d3pjfe.cx.internal.cloudapp.net.51482 > 168.63.129.16.http: Flags [.], cksum 0x3401 (incorrect -> 0x4669), ack 2390, win 538, options [nop,nop,TS val 1701507022 ecr 1978753978], length 0
01:00:07.238801 eth0  Out IP (tos 0x0, ttl 64, id 11156, offset 0, flags [DF], proto TCP (6), length 52)
    fv-az1720-213.5vs45zvnpbiehoyyevf2d3pjfe.cx.internal.cloudapp.net.51482 > 168.63.129.16.http: Flags [F.], cksum 0x3401 (incorrect -> 0x4668), seq 201, ack 2390, win 538, options [nop,nop,TS val 1701507022 ecr 1978753978], length 0
01:00:07.238912 eth0  In  IP (tos 0x0, ttl 128, id 50911, offset 0, flags [DF], proto TCP (6), length 52)
    168.63.129.16.http > fv-az1720-213.5vs45zvnpbiehoyyevf2d3pjfe.cx.internal.cloudapp.net.51482: Flags [.], cksum 0x087e (correct), ack 202, win 16387, options [nop,nop,TS val 1978753979 ecr 1701507022], length 0
01:00:07.239454 eth0  Out IP (tos 0x0, ttl 64, id 3515, offset 0, flags [DF], proto TCP (6), length 60)
    fv-az1720-213.5vs45zvnpbiehoyyevf2d3pjfe.cx.internal.cloudapp.net.53400 > 168.63.129.16.32526: Flags [S], cksum 0x3409 (incorrect -> 0x3488), seq 1700715116, win 64240, options [mss 1460,sackOK,TS val 1701507023 ecr 0,nop,wscale 7], length 0
01:00:07.239697 eth0  In  IP (tos 0x0, ttl 128, id 50912, offset 0, flags [DF], proto TCP (6), length 60)
    168.63.129.16.32526 > fv-az1720-213.5vs45zvnpbiehoyyevf2d3pjfe.cx.internal.cloudapp.net.53400: Flags [S.], cksum 0x8a4c (correct), seq 848009442, ack 1700715117, win 65535, options [mss 1460,nop,wscale 8,sackOK,TS val 1978753979 ecr 1701507023], length 0
01:00:07.239711 eth0  Out IP (tos 0x0, ttl 64, id 3516, offset 0, flags [DF], proto TCP (6), length 52)
    fv-az1720-213.5vs45zvnpbiehoyyevf2d3pjfe.cx.internal.cloudapp.net.53400 > 168.63.129.16.32526: Flags [.], cksum 0x3401 (incorrect -> 0xb723), ack 1, win 502, options [nop,nop,TS val 1701507023 ecr 1978753979], length 0
01:00:07.239730 eth0  Out IP (tos 0x0, ttl 64, id 3517, offset 0, flags [DF], proto TCP (6), length 184)
    fv-az1720-213.5vs45zvnpbiehoyyevf2d3pjfe.cx.internal.cloudapp.net.53400 > 168.63.129.16.32526: Flags [P.], cksum 0x3485 (incorrect -> 0x4289), seq 1:133, ack 1, win 502, options [nop,nop,TS val 1701507023 ecr 1978753979], length 132
01:00:07.240162 eth0  In  IP (tos 0x0, ttl 128, id 50913, offset 0, flags [DF], proto TCP (6), length 253)
    168.63.129.16.32526 > fv-az1720-213.5vs45zvnpbiehoyyevf2d3pjfe.cx.internal.cloudapp.net.53400: Flags [FP.], cksum 0x03e7 (correct), seq 1:202, ack 133, win 16388, options [nop,nop,TS val 1978753980 ecr 1701507023], length 201
01:00:07.240282 eth0  Out IP (tos 0x0, ttl 64, id 3518, offset 0, flags [DF], proto TCP (6), length 52)
    fv-az1720-213.5vs45zvnpbiehoyyevf2d3pjfe.cx.internal.cloudapp.net.53400 > 168.63.129.16.32526: Flags [F.], cksum 0x3401 (incorrect -> 0xb5d3), seq 133, ack 203, win 501, options [nop,nop,TS val 1701507024 ecr 1978753980], length 0
01:00:07.240352 eth0  In  IP (tos 0x0, ttl 128, id 50914, offset 0, flags [DF], proto TCP (6), length 52)
    168.63.129.16.32526 > fv-az1720-213.5vs45zvnpbiehoyyevf2d3pjfe.cx.internal.cloudapp.net.53400: Flags [.], cksum 0x77c4 (correct), ack 134, win 16388, options [nop,nop,TS val 1978753980 ecr 1701507024], length 0
01:00:07.240461 eth0  Out IP (tos 0x0, ttl 64, id 39094, offset 0, flags [DF], proto TCP (6), length 60)
    fv-az1720-213.5vs45zvnpbiehoyyevf2d3pjfe.cx.internal.cloudapp.net.51498 > 168.63.129.16.http: Flags [S], cksum 0x3409 (incorrect -> 0x6c12), seq 2145259150, win 64240, options [mss 1460,sackOK,TS val 1701507024 ecr 0,nop,wscale 7], length 0
01:00:07.240662 eth0  In  IP (tos 0x0, ttl 128, id 50915, offset 0, flags [DF], proto TCP (6), length 60)
    168.63.129.16.http > fv-az1720-213.5vs45zvnpbiehoyyevf2d3pjfe.cx.internal.cloudapp.net.51498: Flags [S.], cksum 0x0239 (correct), seq 2226718289, ack 2145259151, win 65535, options [mss 1460,nop,wscale 8,sackOK,TS val 1978753980 ecr 1701507024], length 0
01:00:07.240681 eth0  Out IP (tos 0x0, ttl 64, id 39095, offset 0, flags [DF], proto TCP (6), length 52)
    fv-az1720-213.5vs45zvnpbiehoyyevf2d3pjfe.cx.internal.cloudapp.net.51498 > 168.63.129.16.http: Flags [.], cksum 0x3401 (incorrect -> 0x2f10), ack 1, win 502, options [nop,nop,TS val 1701507024 ecr 1978753980], length 0
01:00:07.240699 eth0  Out IP (tos 0x0, ttl 64, id 39096, offset 0, flags [DF], proto TCP (6), length 239)
    fv-az1720-213.5vs45zvnpbiehoyyevf2d3pjfe.cx.internal.cloudapp.net.51498 > 168.63.129.16.http: Flags [P.], cksum 0x34bc (incorrect -> 0xef0b), seq 1:188, ack 1, win 502, options [nop,nop,TS val 1701507024 ecr 1978753980], length 187: HTTP, length: 187
	POST /HealthService HTTP/1.1
	Host: 168.63.129.16
	Accept-Encoding: identity
	Content-Length: 192
	Content-Type: application/json
	Connection: close
	User-Agent: WALinuxAgent/2.13.1.1
	
01:00:07.240709 eth0  Out IP (tos 0x0, ttl 64, id 39097, offset 0, flags [DF], proto TCP (6), length 244)
    fv-az1720-213.5vs45zvnpbiehoyyevf2d3pjfe.cx.internal.cloudapp.net.51498 > 168.63.129.16.http: Flags [P.], cksum 0x34c1 (incorrect -> 0xbcc8), seq 188:380, ack 1, win 502, options [nop,nop,TS val 1701507024 ecr 1978753980], length 192: HTTP
01:00:07.240777 eth0  In  IP (tos 0x0, ttl 128, id 50916, offset 0, flags [DF], proto TCP (6), length 52)
    168.63.129.16.http > fv-az1720-213.5vs45zvnpbiehoyyevf2d3pjfe.cx.internal.cloudapp.net.51498: Flags [.], cksum 0xef86 (correct), ack 380, win 16387, options [nop,nop,TS val 1978753981 ecr 1701507024], length 0
01:00:07.242469 eth0  In  IP (tos 0x0, ttl 128, id 50917, offset 0, flags [DF], proto TCP (6), length 202)
    168.63.129.16.http > fv-az1720-213.5vs45zvnpbiehoyyevf2d3pjfe.cx.internal.cloudapp.net.51498: Flags [FP.], cksum 0xaea7 (correct), seq 1:151, ack 380, win 16387, options [nop,nop,TS val 1978753981 ecr 1701507024], length 150: HTTP, length: 150
	HTTP/1.1 200 OK
	Content-Type: text/plain
	Server: Microsoft-IIS/10.0
	Date: Sat, 24 May 2025 01:00:07 GMT
	Connection: close
	Content-Length: 2
	
	OK [|http]
01:00:07.242582 eth0  Out IP (tos 0x0, ttl 64, id 39098, offset 0, flags [DF], proto TCP (6), length 52)
    fv-az1720-213.5vs45zvnpbiehoyyevf2d3pjfe.cx.internal.cloudapp.net.51498 > 168.63.129.16.http: Flags [F.], cksum 0x3401 (incorrect -> 0x2cfb), seq 380, ack 152, win 501, options [nop,nop,TS val 1701507026 ecr 1978753981], length 0
01:00:07.242675 eth0  In  IP (tos 0x0, ttl 128, id 50918, offset 0, flags [DF], proto TCP (6), length 52)
    168.63.129.16.http > fv-az1720-213.5vs45zvnpbiehoyyevf2d3pjfe.cx.internal.cloudapp.net.51498: Flags [.], cksum 0xeeeb (correct), ack 381, win 16387, options [nop,nop,TS val 1978753982 ecr 1701507026], length 0
01:00:07.264552 eth0  Out IP (tos 0x0, ttl 64, id 45968, offset 0, flags [DF], proto TCP (6), length 60)
    fv-az1720-213.5vs45zvnpbiehoyyevf2d3pjfe.cx.internal.cloudapp.net.43076 > 169.254.169.254.http: Flags [S], cksum 0x5eb6 (incorrect -> 0x0be0), seq 2909405636, win 64240, options [mss 1460,sackOK,TS val 2973358506 ecr 0,nop,wscale 7], length 0
01:00:07.264824 eth0  In  IP (tos 0x0, ttl 128, id 50919, offset 0, flags [DF], proto TCP (6), length 60)
    169.254.169.254.http > fv-az1720-213.5vs45zvnpbiehoyyevf2d3pjfe.cx.internal.cloudapp.net.43076: Flags [S.], cksum 0x2549 (correct), seq 1513532792, ack 2909405637, win 65535, options [mss 1460,nop,wscale 8,sackOK,TS val 1978754005 ecr 2973358506], length 0
01:00:07.264843 eth0  Out IP (tos 0x0, ttl 64, id 45969, offset 0, flags [DF], proto TCP (6), length 52)
    fv-az1720-213.5vs45zvnpbiehoyyevf2d3pjfe.cx.internal.cloudapp.net.43076 > 169.254.169.254.http: Flags [.], cksum 0x5eae (incorrect -> 0x5220), ack 1, win 502, options [nop,nop,TS val 2973358506 ecr 1978754005], length 0
01:00:07.264866 eth0  Out IP (tos 0x0, ttl 64, id 45970, offset 0, flags [DF], proto TCP (6), length 237)
    fv-az1720-213.5vs45zvnpbiehoyyevf2d3pjfe.cx.internal.cloudapp.net.43076 > 169.254.169.254.http: Flags [P.], cksum 0x5f67 (incorrect -> 0xde1b), seq 1:186, ack 1, win 502, options [nop,nop,TS val 2973358506 ecr 1978754005], length 185: HTTP, length: 185
	GET /metadata/instance?api-version=2018-02-01 HTTP/1.1
	Host: 169.254.169.254
	Accept-Encoding: identity
	User-Agent: WALinuxAgent/2.13.1.1+health
	Metadata: True
	Connection: close
	
01:00:07.273038 eth0  In  IP (tos 0x0, ttl 128, id 18152, offset 0, flags [DF], proto TCP (6), length 1492)
    169.254.169.254.http > fv-az1720-213.5vs45zvnpbiehoyyevf2d3pjfe.cx.internal.cloudapp.net.43076: Flags [FP.], cksum 0x644e (incorrect -> 0x76e8), seq 1:1441, ack 186, win 16387, options [nop,nop,TS val 1978754007 ecr 2973358506], length 1440: HTTP, length: 1440
	HTTP/1.1 200 OK
	Content-Type: application/json; charset=utf-8
	Server: IMDS/150.870.65.1544
	x-ms-request-id: 6e6843f5-df56-4e9e-9660-389c1cdea075
	Date: Sat, 24 May 2025 01:00:07 GMT
	Connection: close
	Content-Length: 1211
	
	{"compute":{"location":"eastus2","name":"EUS2-GCUS1U24J110J51-0073","offer":"","osType":"Linux","placementGroupId":"","platformFaultDomain":"0","platformUpdateDomain":"0","publisher":"","resourceGroupName":"gcus1u24j110j51","sku":"","subscriptionId":"df6a20b0-48aa-4247-883a-706218f79859","tags":"OperatorOverridableTenantSettings.Tenant.Setting.BypassCmPeSyncForRepaves:True;SkipASMAV:true;SkipASMAzSecPack:true;SkipASMAzSecPackAutoConfig:true;SkipLinuxAzSecPack:true;SkipWindowsAzSecPack:true;ms.inv.v0.backedby.origin.sourcearmid.0:/subscriptions/df6a20b0-48aa-4247-883a-706218f79859/resourceGroups/gcus1u24j110j51/providers/Microsoft.Compute/virtualMachines/EUS2-GCUS1U24J110J51-0073;ms.inv.v0.backedby.origin.tenantid:33e01921-4d64-4f8c-a055-5bdaffd5e33d;ms.inv.v0.security.ownerrole:None;platformsettings.host_environment.service.platform_optedin_for_rootcerts:true","version":"0.0.107521626","vmId":"3a64f8d7-a5ac-494e-8514-af3db486cf28","vmScaleSetName":"","vmSize":"Standard_D4ads_v5","zone":""},"network":{"interface":[{"ipv4":{"ipAddress":[{"privateIpAddress":"10.1.0.138","publicIpAddress":""}],"subnet":[{"address":"10.1.0.0","prefix":"16"}]},"ipv6":{"ipAddress":[]},"macAddress":"6045BDB8CDF5"}]}} [|http]
01:00:07.273065 eth0  Out IP (tos 0x0, ttl 64, id 45971, offset 0, flags [DF], proto TCP (6), length 52)
    fv-az1720-213.5vs45zvnpbiehoyyevf2d3pjfe.cx.internal.cloudapp.net.43076 > 169.254.169.254.http: Flags [.], cksum 0x5eae (incorrect -> 0x4bc6), ack 1442, win 491, options [nop,nop,TS val 2973358515 ecr 1978754007], length 0
01:00:07.273202 eth0  Out IP (tos 0x0, ttl 64, id 45972, offset 0, flags [DF], proto TCP (6), length 52)
    fv-az1720-213.5vs45zvnpbiehoyyevf2d3pjfe.cx.internal.cloudapp.net.43076 > 169.254.169.254.http: Flags [F.], cksum 0x5eae (incorrect -> 0x4bc5), seq 186, ack 1442, win 491, options [nop,nop,TS val 2973358515 ecr 1978754007], length 0
01:00:07.273300 eth0  In  IP (tos 0x0, ttl 128, id 50922, offset 0, flags [DF], proto TCP (6), length 52)
    169.254.169.254.http > fv-az1720-213.5vs45zvnpbiehoyyevf2d3pjfe.cx.internal.cloudapp.net.43076: Flags [.], cksum 0x0da7 (correct), ack 187, win 16387, options [nop,nop,TS val 1978754013 ecr 2973358515], length 0
01:00:07.273418 eth0  Out IP (tos 0x0, ttl 64, id 16556, offset 0, flags [DF], proto TCP (6), length 60)
    fv-az1720-213.5vs45zvnpbiehoyyevf2d3pjfe.cx.internal.cloudapp.net.51512 > 168.63.129.16.http: Flags [S], cksum 0x3409 (incorrect -> 0xf52c), seq 2713805665, win 64240, options [mss 1460,sackOK,TS val 1701507057 ecr 0,nop,wscale 7], length 0
01:00:07.273727 eth0  In  IP (tos 0x0, ttl 128, id 50923, offset 0, flags [DF], proto TCP (6), length 60)
    168.63.129.16.http > fv-az1720-213.5vs45zvnpbiehoyyevf2d3pjfe.cx.internal.cloudapp.net.51512: Flags [S.], cksum 0x2b90 (correct), seq 2765702611, ack 2713805666, win 65535, options [mss 1460,nop,wscale 8,sackOK,TS val 1978754013 ecr 1701507057], length 0
01:00:07.273751 eth0  Out IP (tos 0x0, ttl 64, id 16557, offset 0, flags [DF], proto TCP (6), length 52)
    fv-az1720-213.5vs45zvnpbiehoyyevf2d3pjfe.cx.internal.cloudapp.net.51512 > 168.63.129.16.http: Flags [.], cksum 0x3401 (incorrect -> 0x5867), ack 1, win 502, options [nop,nop,TS val 1701507057 ecr 1978754013], length 0
01:00:07.273775 eth0  Out IP (tos 0x0, ttl 64, id 16558, offset 0, flags [DF], proto TCP (6), length 239)
    fv-az1720-213.5vs45zvnpbiehoyyevf2d3pjfe.cx.internal.cloudapp.net.51512 > 168.63.129.16.http: Flags [P.], cksum 0x34bc (incorrect -> 0x1863), seq 1:188, ack 1, win 502, options [nop,nop,TS val 1701507057 ecr 1978754013], length 187: HTTP, length: 187
	POST /HealthService HTTP/1.1
	Host: 168.63.129.16
	Accept-Encoding: identity
	Content-Length: 192
	Content-Type: application/json
	Connection: close
	User-Agent: WALinuxAgent/2.13.1.1
	
01:00:07.273786 eth0  Out IP (tos 0x0, ttl 64, id 16559, offset 0, flags [DF], proto TCP (6), length 244)
    fv-az1720-213.5vs45zvnpbiehoyyevf2d3pjfe.cx.internal.cloudapp.net.51512 > 168.63.129.16.http: Flags [P.], cksum 0x34c1 (incorrect -> 0xf025), seq 188:380, ack 1, win 502, options [nop,nop,TS val 1701507057 ecr 1978754013], length 192: HTTP
01:00:07.273937 eth0  In  IP (tos 0x0, ttl 128, id 50924, offset 0, flags [DF], proto TCP (6), length 52)
    168.63.129.16.http > fv-az1720-213.5vs45zvnpbiehoyyevf2d3pjfe.cx.internal.cloudapp.net.51512: Flags [.], cksum 0x18de (correct), ack 380, win 16387, options [nop,nop,TS val 1978754014 ecr 1701507057], length 0
01:00:07.275747 eth0  In  IP (tos 0x0, ttl 128, id 50925, offset 0, flags [DF], proto TCP (6), length 202)
    168.63.129.16.http > fv-az1720-213.5vs45zvnpbiehoyyevf2d3pjfe.cx.internal.cloudapp.net.51512: Flags [FP.], cksum 0xd7fc (correct), seq 1:151, ack 380, win 16387, options [nop,nop,TS val 1978754016 ecr 1701507057], length 150: HTTP, length: 150
	HTTP/1.1 200 OK
	Content-Type: text/plain
	Server: Microsoft-IIS/10.0
	Date: Sat, 24 May 2025 01:00:07 GMT
	Connection: close
	Content-Length: 2
	
	OK [|http]
01:00:07.275865 eth0  Out IP (tos 0x0, ttl 64, id 16560, offset 0, flags [DF], proto TCP (6), length 52)
    fv-az1720-213.5vs45zvnpbiehoyyevf2d3pjfe.cx.internal.cloudapp.net.51512 > 168.63.129.16.http: Flags [F.], cksum 0x3401 (incorrect -> 0x5650), seq 380, ack 152, win 501, options [nop,nop,TS val 1701507059 ecr 1978754016], length 0
01:00:07.275965 eth0  In  IP (tos 0x0, ttl 128, id 50926, offset 0, flags [DF], proto TCP (6), length 52)
    168.63.129.16.http > fv-az1720-213.5vs45zvnpbiehoyyevf2d3pjfe.cx.internal.cloudapp.net.51512: Flags [.], cksum 0x1842 (correct), ack 381, win 16387, options [nop,nop,TS val 1978754016 ecr 1701507059], length 0
01:00:10.362055 eth0  Out IP (tos 0x0, ttl 64, id 43333, offset 0, flags [DF], proto TCP (6), length 52)
    fv-az1720-213.5vs45zvnpbiehoyyevf2d3pjfe.cx.internal.cloudapp.net.51992 > 140.82.112.21.https: Flags [.], cksum 0x0719 (incorrect -> 0xf5c5), ack 1113671646, win 1220, options [nop,nop,TS val 4029548688 ecr 2328456093], length 0
01:00:10.367734 eth0  In  IP (tos 0x0, ttl 48, id 22842, offset 0, flags [DF], proto TCP (6), length 52)
    140.82.112.21.https > fv-az1720-213.5vs45zvnpbiehoyyevf2d3pjfe.cx.internal.cloudapp.net.51992: Flags [.], cksum 0xf993 (correct), ack 1, win 240, options [nop,nop,TS val 2328471354 ecr 4029533432], length 0
01:00:12.124106 eth0  Out IP (tos 0x0, ttl 64, id 37867, offset 0, flags [DF], proto TCP (6), length 60)
    fv-az1720-213.5vs45zvnpbiehoyyevf2d3pjfe.cx.internal.cloudapp.net.51526 > 168.63.129.16.http: Flags [S], cksum 0x3409 (incorrect -> 0x66e3), seq 1800738070, win 64240, options [mss 1460,sackOK,TS val 1701511908 ecr 0,nop,wscale 7], length 0
01:00:12.124404 eth0  In  IP (tos 0x0, ttl 128, id 50927, offset 0, flags [DF], proto TCP (6), length 60)
    168.63.129.16.http > fv-az1720-213.5vs45zvnpbiehoyyevf2d3pjfe.cx.internal.cloudapp.net.51526: Flags [S.], cksum 0x3bf1 (correct), seq 3802486377, ack 1800738071, win 65535, options [mss 1460,nop,wscale 8,sackOK,TS val 1978758864 ecr 1701511908], length 0
01:00:12.124436 eth0  Out IP (tos 0x0, ttl 64, id 37868, offset 0, flags [DF], proto TCP (6), length 52)
    fv-az1720-213.5vs45zvnpbiehoyyevf2d3pjfe.cx.internal.cloudapp.net.51526 > 168.63.129.16.http: Flags [.], cksum 0x3401 (incorrect -> 0x68c8), ack 1, win 502, options [nop,nop,TS val 1701511908 ecr 1978758864], length 0
01:00:12.124482 eth0  Out IP (tos 0x0, ttl 64, id 37869, offset 0, flags [DF], proto TCP (6), length 252)
    fv-az1720-213.5vs45zvnpbiehoyyevf2d3pjfe.cx.internal.cloudapp.net.51526 > 168.63.129.16.http: Flags [P.], cksum 0x34c9 (incorrect -> 0x7869), seq 1:201, ack 1, win 502, options [nop,nop,TS val 1701511908 ecr 1978758864], length 200: HTTP, length: 200
	GET /machine/?comp=goalstate HTTP/1.1
	Host: 168.63.129.16
	Accept-Encoding: identity
	x-ms-agent-name: WALinuxAgent
	x-ms-version: 2012-11-30
	Connection: close
	User-Agent: WALinuxAgent/2.13.1.1
	
01:00:12.126071 eth0  In  IP (tos 0x0, ttl 128, id 18160, offset 0, flags [DF], proto TCP (6), length 2440)
    168.63.129.16.http > fv-az1720-213.5vs45zvnpbiehoyyevf2d3pjfe.cx.internal.cloudapp.net.51526: Flags [FP.], cksum 0x3d55 (incorrect -> 0x5daf), seq 1:2389, ack 201, win 16387, options [nop,nop,TS val 1978758864 ecr 1701511908], length 2388: HTTP, length: 2388
	HTTP/1.1 200 OK
	Content-Type: text/xml; charset=utf-8
	Server: Microsoft-IIS/10.0
	Date: Sat, 24 May 2025 01:00:11 GMT
	Connection: close
	Content-Length: 2224
	
	<?xml version="1.0" encoding="utf-8"?>
	<GoalState xmlns:xsi="http://www.w3.org/2001/XMLSchema-instance" xsi:noNamespaceSchemaLocation="goalstate10.xsd">
	  <Version>2012-11-30</Version>
	  <Incarnation>1</Incarnation>
	  <Machine>
	    <ExpectedState>Started</ExpectedState>
	    <StopRolesDeadlineHint>300000</StopRolesDeadlineHint>
	    <LBProbePorts>
	      <Port>16001</Port>
	    </LBProbePorts>
	    <ExpectHealthReport>FALSE</ExpectHealthReport>
	  </Machine>
	  <Container>
	    <ContainerId>53011767-77ae-4b65-b198-2f2f03dae266</ContainerId>
	    <RoleInstanceList>
	      <RoleInstance>
	        <InstanceId>f50e4b26-82ca-4d1e-bb16-7167849ca85d._EUS2-GCUS1U24J110J51-0073</InstanceId>
	        <State>Started</State>
	        <Configuration>
	          <HostingEnvironmentConfig>http://168.63.129.16:80/machine/53011767-77ae-4b65-b198-2f2f03dae266/f50e4b26%2D82ca%2D4d1e%2Dbb16%2D7167849ca85d.%5FEUS2%2DGCUS1U24J110J51%2D0073?comp=config&amp;type=hostingEnvironmentConfig&amp;incarnation=1</HostingEnvironmentConfig>
	          <SharedConfig>http://168.63.129.16:80/machine/53011767-77ae-4b65-b198-2f2f03dae266/f50e4b26%2D82ca%2D4d1e%2Dbb16%2D7167849ca85d.%5FEUS2%2DGCUS1U24J110J51%2D0073?comp=config&amp;type=sharedConfig&amp;incarnation=1</SharedConfig>
	          <ExtensionsConfig>http://168.63.129.16:80/machine/53011767-77ae-4b65-b198-2f2f03dae266/f50e4b26%2D82ca%2D4d1e%2Dbb16%2D7167849ca85d.%5FEUS2%2DGCUS1U24J110J51%2D0073?comp=config&amp;type=extensionsConfig&amp;incarnation=1</ExtensionsConfig>
	          <FullConfig>http://168.63.129.16:80/machine/53011767-77ae-4b65-b198-2f2f03dae266/f50e4b26%2D82ca%2D4d1e%2Dbb16%2D7167849ca85d.%5FEUS2%2DGCUS1U24J110J51%2D0073?comp=config&amp;type=fullConfig&amp;incarnation=1</FullConfig>
	          <Certificates>http://168.63.129.16:80/machine/53011767-77ae-4b65-b198-2f2f03dae266/f50e4b26%2D82ca%2D4d1e%2Dbb16%2D7167849ca85d.%5FEUS2%2DGCUS1U24J110J51%2D0073?comp=certificates&amp;incarnation=1</Certificates>
	          <ConfigName>f50e4b26-82ca-4d1e-bb16-7167849ca85d.1.f50e4b26-82ca-4d1e-bb16-7167849ca85d.1._EUS2-GCUS1U24J110J51-0073.1.xml</ConfigName>
	        </Configuration>
	      </RoleInstance>
	    </RoleInstanceList>
	  </Container>
	</GoalState> [|http]
01:00:12.126092 eth0  Out IP (tos 0x0, ttl 64, id 37870, offset 0, flags [DF], proto TCP (6), length 52)
    fv-az1720-213.5vs45zvnpbiehoyyevf2d3pjfe.cx.internal.cloudapp.net.51526 > 168.63.129.16.http: Flags [.], cksum 0x3401 (incorrect -> 0x5e85), ack 2390, win 538, options [nop,nop,TS val 1701511910 ecr 1978758864], length 0
01:00:12.126267 eth0  Out IP (tos 0x0, ttl 64, id 37871, offset 0, flags [DF], proto TCP (6), length 52)
    fv-az1720-213.5vs45zvnpbiehoyyevf2d3pjfe.cx.internal.cloudapp.net.51526 > 168.63.129.16.http: Flags [F.], cksum 0x3401 (incorrect -> 0x5e84), seq 201, ack 2390, win 538, options [nop,nop,TS val 1701511910 ecr 1978758864], length 0
01:00:12.126411 eth0  In  IP (tos 0x0, ttl 128, id 50930, offset 0, flags [DF], proto TCP (6), length 52)
    168.63.129.16.http > fv-az1720-213.5vs45zvnpbiehoyyevf2d3pjfe.cx.internal.cloudapp.net.51526: Flags [.], cksum 0x2099 (correct), ack 202, win 16387, options [nop,nop,TS val 1978758866 ecr 1701511910], length 0
01:00:12.126736 eth0  Out IP (tos 0x0, ttl 64, id 27992, offset 0, flags [DF], proto TCP (6), length 60)
    fv-az1720-213.5vs45zvnpbiehoyyevf2d3pjfe.cx.internal.cloudapp.net.53416 > 168.63.129.16.32526: Flags [S], cksum 0x3409 (incorrect -> 0x209c), seq 966919918, win 64240, options [mss 1460,sackOK,TS val 1701511910 ecr 0,nop,wscale 7], length 0
01:00:12.126946 eth0  In  IP (tos 0x0, ttl 128, id 50931, offset 0, flags [DF], proto TCP (6), length 60)
    168.63.129.16.32526 > fv-az1720-213.5vs45zvnpbiehoyyevf2d3pjfe.cx.internal.cloudapp.net.53416: Flags [S.], cksum 0xaf3d (correct), seq 1257190537, ack 966919919, win 65535, options [mss 1460,nop,wscale 8,sackOK,TS val 1978758867 ecr 1701511910], length 0
01:00:12.126966 eth0  Out IP (tos 0x0, ttl 64, id 27993, offset 0, flags [DF], proto TCP (6), length 52)
    fv-az1720-213.5vs45zvnpbiehoyyevf2d3pjfe.cx.internal.cloudapp.net.53416 > 168.63.129.16.32526: Flags [.], cksum 0x3401 (incorrect -> 0xdc14), ack 1, win 502, options [nop,nop,TS val 1701511910 ecr 1978758867], length 0
01:00:12.127011 eth0  Out IP (tos 0x0, ttl 64, id 27994, offset 0, flags [DF], proto TCP (6), length 507)
    fv-az1720-213.5vs45zvnpbiehoyyevf2d3pjfe.cx.internal.cloudapp.net.53416 > 168.63.129.16.32526: Flags [P.], cksum 0x35c8 (incorrect -> 0xa8f6), seq 1:456, ack 1, win 502, options [nop,nop,TS val 1701511910 ecr 1978758867], length 455
01:00:12.130527 eth0  In  IP (tos 0x0, ttl 128, id 50932, offset 0, flags [DF], proto TCP (6), length 197)
    168.63.129.16.32526 > fv-az1720-213.5vs45zvnpbiehoyyevf2d3pjfe.cx.internal.cloudapp.net.53416: Flags [FP.], cksum 0xa167 (correct), seq 1:146, ack 456, win 16386, options [nop,nop,TS val 1978758870 ecr 1701511910], length 145
01:00:12.130644 eth0  Out IP (tos 0x0, ttl 64, id 27995, offset 0, flags [DF], proto TCP (6), length 52)
    fv-az1720-213.5vs45zvnpbiehoyyevf2d3pjfe.cx.internal.cloudapp.net.53416 > 168.63.129.16.32526: Flags [F.], cksum 0x3401 (incorrect -> 0xd9b4), seq 456, ack 147, win 501, options [nop,nop,TS val 1701511914 ecr 1978758870], length 0
01:00:12.130887 eth0  In  IP (tos 0x0, ttl 128, id 50933, offset 0, flags [DF], proto TCP (6), length 52)
    168.63.129.16.32526 > fv-az1720-213.5vs45zvnpbiehoyyevf2d3pjfe.cx.internal.cloudapp.net.53416: Flags [.], cksum 0x9ba6 (correct), ack 457, win 16386, options [nop,nop,TS val 1978758871 ecr 1701511914], length 0
01:00:12.131214 eth0  Out IP (tos 0x0, ttl 64, id 18241, offset 0, flags [DF], proto TCP (6), length 60)
    fv-az1720-213.5vs45zvnpbiehoyyevf2d3pjfe.cx.internal.cloudapp.net.53422 > 168.63.129.16.32526: Flags [S], cksum 0x3409 (incorrect -> 0x034e), seq 1255805689, win 64240, options [mss 1460,sackOK,TS val 1701511915 ecr 0,nop,wscale 7], length 0
01:00:12.131505 eth0  In  IP (tos 0x0, ttl 128, id 50934, offset 0, flags [DF], proto TCP (6), length 60)
    168.63.129.16.32526 > fv-az1720-213.5vs45zvnpbiehoyyevf2d3pjfe.cx.internal.cloudapp.net.53422: Flags [S.], cksum 0x8524 (correct), seq 157057763, ack 1255805690, win 65535, options [mss 1460,nop,wscale 8,sackOK,TS val 1978758871 ecr 1701511915], length 0
01:00:12.131520 eth0  Out IP (tos 0x0, ttl 64, id 18242, offset 0, flags [DF], proto TCP (6), length 52)
    fv-az1720-213.5vs45zvnpbiehoyyevf2d3pjfe.cx.internal.cloudapp.net.53422 > 168.63.129.16.32526: Flags [.], cksum 0x3401 (incorrect -> 0xb1fb), ack 1, win 502, options [nop,nop,TS val 1701511915 ecr 1978758871], length 0
01:00:12.131538 eth0  Out IP (tos 0x0, ttl 64, id 18243, offset 0, flags [DF], proto TCP (6), length 454)
    fv-az1720-213.5vs45zvnpbiehoyyevf2d3pjfe.cx.internal.cloudapp.net.53422 > 168.63.129.16.32526: Flags [P.], cksum 0x3593 (incorrect -> 0x4154), seq 1:403, ack 1, win 502, options [nop,nop,TS val 1701511915 ecr 1978758871], length 402
01:00:12.131548 eth0  Out IP (tos 0x0, ttl 64, id 18244, offset 0, flags [DF], proto TCP (6), length 642)
    fv-az1720-213.5vs45zvnpbiehoyyevf2d3pjfe.cx.internal.cloudapp.net.53422 > 168.63.129.16.32526: Flags [P.], cksum 0x364f (incorrect -> 0x46de), seq 403:993, ack 1, win 502, options [nop,nop,TS val 1701511915 ecr 1978758871], length 590
01:00:12.131651 eth0  In  IP (tos 0x0, ttl 128, id 50935, offset 0, flags [DF], proto TCP (6), length 52)
    168.63.129.16.32526 > fv-az1720-213.5vs45zvnpbiehoyyevf2d3pjfe.cx.internal.cloudapp.net.53422: Flags [.], cksum 0x7011 (correct), ack 993, win 16384, options [nop,nop,TS val 1978758871 ecr 1701511915], length 0
01:00:12.132101 eth0  In  IP (tos 0x0, ttl 128, id 50936, offset 0, flags [DF], proto TCP (6), length 206)
    168.63.129.16.32526 > fv-az1720-213.5vs45zvnpbiehoyyevf2d3pjfe.cx.internal.cloudapp.net.53422: Flags [FP.], cksum 0x7afa (correct), seq 1:155, ack 993, win 16384, options [nop,nop,TS val 1978758872 ecr 1701511915], length 154
01:00:12.132323 eth0  Out IP (tos 0x0, ttl 64, id 23915, offset 0, flags [DF], proto TCP (6), length 60)
    fv-az1720-213.5vs45zvnpbiehoyyevf2d3pjfe.cx.internal.cloudapp.net.51528 > 168.63.129.16.http: Flags [S], cksum 0x3409 (incorrect -> 0x45c3), seq 3009998360, win 64240, options [mss 1460,sackOK,TS val 1701511916 ecr 0,nop,wscale 7], length 0
01:00:12.132537 eth0  In  IP (tos 0x0, ttl 128, id 50937, offset 0, flags [DF], proto TCP (6), length 60)
    168.63.129.16.http > fv-az1720-213.5vs45zvnpbiehoyyevf2d3pjfe.cx.internal.cloudapp.net.51528: Flags [S.], cksum 0x8fff (correct), seq 1894404846, ack 3009998361, win 65535, options [mss 1460,nop,wscale 8,sackOK,TS val 1978758872 ecr 1701511916], length 0
01:00:12.132559 eth0  Out IP (tos 0x0, ttl 64, id 23916, offset 0, flags [DF], proto TCP (6), length 52)
    fv-az1720-213.5vs45zvnpbiehoyyevf2d3pjfe.cx.internal.cloudapp.net.51528 > 168.63.129.16.http: Flags [.], cksum 0x3401 (incorrect -> 0xbcd6), ack 1, win 502, options [nop,nop,TS val 1701511916 ecr 1978758872], length 0
01:00:12.132577 eth0  Out IP (tos 0x0, ttl 64, id 23917, offset 0, flags [DF], proto TCP (6), length 239)
    fv-az1720-213.5vs45zvnpbiehoyyevf2d3pjfe.cx.internal.cloudapp.net.51528 > 168.63.129.16.http: Flags [P.], cksum 0x34bc (incorrect -> 0x75d3), seq 1:188, ack 1, win 502, options [nop,nop,TS val 1701511916 ecr 1978758872], length 187: HTTP, length: 187
	POST /HealthService HTTP/1.1
	Host: 168.63.129.16
	Accept-Encoding: identity
	Content-Length: 189
	Content-Type: application/json
	Connection: close
	User-Agent: WALinuxAgent/2.13.1.1
	
01:00:12.132645 eth0  Out IP (tos 0x0, ttl 64, id 23918, offset 0, flags [DF], proto TCP (6), length 241)
    fv-az1720-213.5vs45zvnpbiehoyyevf2d3pjfe.cx.internal.cloudapp.net.51528 > 168.63.129.16.http: Flags [P.], cksum 0x34be (incorrect -> 0x5594), seq 188:377, ack 1, win 502, options [nop,nop,TS val 1701511916 ecr 1978758872], length 189: HTTP
01:00:12.132828 eth0  In  IP (tos 0x0, ttl 128, id 50938, offset 0, flags [DF], proto TCP (6), length 52)
    168.63.129.16.http > fv-az1720-213.5vs45zvnpbiehoyyevf2d3pjfe.cx.internal.cloudapp.net.51528: Flags [.], cksum 0x7d50 (correct), ack 377, win 16387, options [nop,nop,TS val 1978758873 ecr 1701511916], length 0
01:00:12.134362 eth0  In  IP (tos 0x0, ttl 128, id 50939, offset 0, flags [DF], proto TCP (6), length 202)
    168.63.129.16.http > fv-az1720-213.5vs45zvnpbiehoyyevf2d3pjfe.cx.internal.cloudapp.net.51528: Flags [FP.], cksum 0x3b76 (correct), seq 1:151, ack 377, win 16387, options [nop,nop,TS val 1978758874 ecr 1701511916], length 150: HTTP, length: 150
	HTTP/1.1 200 OK
	Content-Type: text/plain
	Server: Microsoft-IIS/10.0
	Date: Sat, 24 May 2025 01:00:11 GMT
	Connection: close
	Content-Length: 2
	
	OK [|http]
01:00:12.134479 eth0  Out IP (tos 0x0, ttl 64, id 23919, offset 0, flags [DF], proto TCP (6), length 52)
    fv-az1720-213.5vs45zvnpbiehoyyevf2d3pjfe.cx.internal.cloudapp.net.51528 > 168.63.129.16.http: Flags [F.], cksum 0x3401 (incorrect -> 0xbac3), seq 377, ack 152, win 501, options [nop,nop,TS val 1701511918 ecr 1978758874], length 0
01:00:12.134594 eth0  In  IP (tos 0x0, ttl 128, id 50940, offset 0, flags [DF], proto TCP (6), length 52)
    168.63.129.16.http > fv-az1720-213.5vs45zvnpbiehoyyevf2d3pjfe.cx.internal.cloudapp.net.51528: Flags [.], cksum 0x7cb5 (correct), ack 378, win 16387, options [nop,nop,TS val 1978758874 ecr 1701511918], length 0
01:00:12.134695 eth0  Out IP (tos 0x0, ttl 64, id 59936, offset 0, flags [DF], proto TCP (6), length 60)
    fv-az1720-213.5vs45zvnpbiehoyyevf2d3pjfe.cx.internal.cloudapp.net.53430 > 168.63.129.16.32526: Flags [S], cksum 0x3409 (incorrect -> 0xe72a), seq 152465621, win 64240, options [mss 1460,sackOK,TS val 1701511918 ecr 0,nop,wscale 7], length 0
01:00:12.134911 eth0  In  IP (tos 0x0, ttl 128, id 50941, offset 0, flags [DF], proto TCP (6), length 60)
    168.63.129.16.32526 > fv-az1720-213.5vs45zvnpbiehoyyevf2d3pjfe.cx.internal.cloudapp.net.53430: Flags [S.], cksum 0x4415 (correct), seq 3622361406, ack 152465622, win 65535, options [mss 1460,nop,wscale 8,sackOK,TS val 1978758875 ecr 1701511918], length 0
01:00:12.134924 eth0  Out IP (tos 0x0, ttl 64, id 59937, offset 0, flags [DF], proto TCP (6), length 52)
    fv-az1720-213.5vs45zvnpbiehoyyevf2d3pjfe.cx.internal.cloudapp.net.53430 > 168.63.129.16.32526: Flags [.], cksum 0x3401 (incorrect -> 0x70ec), ack 1, win 502, options [nop,nop,TS val 1701511918 ecr 1978758875], length 0
01:00:12.134944 eth0  Out IP (tos 0x0, ttl 64, id 59938, offset 0, flags [DF], proto TCP (6), length 455)
    fv-az1720-213.5vs45zvnpbiehoyyevf2d3pjfe.cx.internal.cloudapp.net.53430 > 168.63.129.16.32526: Flags [P.], cksum 0x3594 (incorrect -> 0xc744), seq 1:404, ack 1, win 502, options [nop,nop,TS val 1701511918 ecr 1978758875], length 403
01:00:12.134955 eth0  Out IP (tos 0x0, ttl 64, id 59939, offset 0, flags [DF], proto TCP (6), length 2711)
    fv-az1720-213.5vs45zvnpbiehoyyevf2d3pjfe.cx.internal.cloudapp.net.53430 > 168.63.129.16.32526: Flags [P.], cksum 0x3e64 (incorrect -> 0x6bfe), seq 404:3063, ack 1, win 502, options [nop,nop,TS val 1701511918 ecr 1978758875], length 2659
01:00:12.135132 eth0  In  IP (tos 0x0, ttl 128, id 50942, offset 0, flags [DF], proto TCP (6), length 52)
    168.63.129.16.32526 > fv-az1720-213.5vs45zvnpbiehoyyevf2d3pjfe.cx.internal.cloudapp.net.53430: Flags [.], cksum 0x26e8 (correct), ack 3063, win 16388, options [nop,nop,TS val 1978758875 ecr 1701511918], length 0
01:00:12.146604 eth0  In  IP (tos 0x0, ttl 128, id 50943, offset 0, flags [DF], proto TCP (6), length 206)
    168.63.129.16.32526 > fv-az1720-213.5vs45zvnpbiehoyyevf2d3pjfe.cx.internal.cloudapp.net.53430: Flags [FP.], cksum 0x31cb (correct), seq 1:155, ack 3063, win 16388, options [nop,nop,TS val 1978758882 ecr 1701511918], length 154
01:00:12.146745 eth0  Out IP (tos 0x0, ttl 64, id 18245, offset 0, flags [DF], proto TCP (6), length 52)
    fv-az1720-213.5vs45zvnpbiehoyyevf2d3pjfe.cx.internal.cloudapp.net.53422 > 168.63.129.16.32526: Flags [F.], cksum 0x3401 (incorrect -> 0xad70), seq 993, ack 156, win 501, options [nop,nop,TS val 1701511930 ecr 1978758872], length 0
01:00:12.146768 eth0  Out IP (tos 0x0, ttl 64, id 59941, offset 0, flags [DF], proto TCP (6), length 52)
    fv-az1720-213.5vs45zvnpbiehoyyevf2d3pjfe.cx.internal.cloudapp.net.53430 > 168.63.129.16.32526: Flags [F.], cksum 0x3401 (incorrect -> 0x6448), seq 3063, ack 156, win 501, options [nop,nop,TS val 1701511930 ecr 1978758882], length 0
01:00:12.146935 eth0  In  IP (tos 0x0, ttl 128, id 50944, offset 0, flags [DF], proto TCP (6), length 52)
    168.63.129.16.32526 > fv-az1720-213.5vs45zvnpbiehoyyevf2d3pjfe.cx.internal.cloudapp.net.53422: Flags [.], cksum 0x6f56 (correct), ack 994, win 16384, options [nop,nop,TS val 1978758887 ecr 1701511930], length 0
01:00:12.146935 eth0  In  IP (tos 0x0, ttl 128, id 50945, offset 0, flags [DF], proto TCP (6), length 52)
    168.63.129.16.32526 > fv-az1720-213.5vs45zvnpbiehoyyevf2d3pjfe.cx.internal.cloudapp.net.53430: Flags [.], cksum 0x2634 (correct), ack 3064, win 16388, options [nop,nop,TS val 1978758887 ecr 1701511930], length 0
01:00:14.360091 eth0  Out IP (tos 0x0, ttl 64, id 25449, offset 0, flags [DF], proto TCP (6), length 76)
    fv-az1720-213.5vs45zvnpbiehoyyevf2d3pjfe.cx.internal.cloudapp.net.51998 > 140.82.112.21.https: Flags [P.], cksum 0x0731 (incorrect -> 0xd175), seq 2118314926:2118314950, ack 95699598, win 662, options [nop,nop,TS val 4029552686 ecr 1085457723], length 24
01:00:14.360151 eth0  Out IP (tos 0x0, ttl 64, id 25450, offset 0, flags [DF], proto TCP (6), length 52)
    fv-az1720-213.5vs45zvnpbiehoyyevf2d3pjfe.cx.internal.cloudapp.net.51998 > 140.82.112.21.https: Flags [F.], cksum 0x0719 (incorrect -> 0xdfc3), seq 24, ack 1, win 662, options [nop,nop,TS val 4029552686 ecr 1085457723], length 0
01:00:14.365690 eth0  In  IP (tos 0x0, ttl 48, id 34744, offset 0, flags [DF], proto TCP (6), length 52)
    140.82.112.21.https > fv-az1720-213.5vs45zvnpbiehoyyevf2d3pjfe.cx.internal.cloudapp.net.51998: Flags [.], cksum 0x6e76 (correct), ack 24, win 70, options [nop,nop,TS val 1085487321 ecr 4029552686], length 0
01:00:14.365690 eth0  In  IP (tos 0x0, ttl 48, id 34745, offset 0, flags [DF], proto TCP (6), length 76)
    140.82.112.21.https > fv-az1720-213.5vs45zvnpbiehoyyevf2d3pjfe.cx.internal.cloudapp.net.51998: Flags [P.], cksum 0x600f (correct), seq 1:25, ack 25, win 70, options [nop,nop,TS val 1085487321 ecr 4029552686], length 24
01:00:14.365690 eth0  In  IP (tos 0x0, ttl 48, id 34746, offset 0, flags [DF], proto TCP (6), length 52)
    140.82.112.21.https > fv-az1720-213.5vs45zvnpbiehoyyevf2d3pjfe.cx.internal.cloudapp.net.51998: Flags [F.], cksum 0x6e5c (correct), seq 25, ack 25, win 70, options [nop,nop,TS val 1085487321 ecr 4029552686], length 0
01:00:14.365729 eth0  Out IP (tos 0x0, ttl 64, id 0, offset 0, flags [DF], proto TCP (6), length 40)
    fv-az1720-213.5vs45zvnpbiehoyyevf2d3pjfe.cx.internal.cloudapp.net.51998 > 140.82.112.21.https: Flags [R], cksum 0x720a (correct), seq 2118314951, win 0, length 0
01:00:14.365740 eth0  Out IP (tos 0x0, ttl 64, id 0, offset 0, flags [DF], proto TCP (6), length 40)
    fv-az1720-213.5vs45zvnpbiehoyyevf2d3pjfe.cx.internal.cloudapp.net.51998 > 140.82.112.21.https: Flags [R], cksum 0x720a (correct), seq 2118314951, win 0, length 0
01:00:14.909131 eth0  Out IP (tos 0x0, ttl 64, id 13656, offset 0, flags [DF], proto TCP (6), length 2676)
    fv-az1720-213.5vs45zvnpbiehoyyevf2d3pjfe.cx.internal.cloudapp.net.51502 > 20.10.226.54.https: Flags [P.], cksum 0x0b32 (incorrect -> 0xeb63), seq 3883373363:3883375987, ack 3415608101, win 695, options [nop,nop,TS val 950779219 ecr 3801396222], length 2624
01:00:14.910365 eth0  In  IP (tos 0x0, ttl 62, id 48062, offset 0, flags [DF], proto TCP (6), length 52)
    20.10.226.54.https > fv-az1720-213.5vs45zvnpbiehoyyevf2d3pjfe.cx.internal.cloudapp.net.51502: Flags [.], cksum 0xd675 (correct), ack 2624, win 501, options [nop,nop,TS val 3801456225 ecr 950779219], length 0
01:00:14.922992 eth0  In  IP (tos 0x0, ttl 62, id 48063, offset 0, flags [DF], proto TCP (6), length 3697)
    20.10.226.54.https > fv-az1720-213.5vs45zvnpbiehoyyevf2d3pjfe.cx.internal.cloudapp.net.51502: Flags [P.], cksum 0x0f2f (incorrect -> 0xc9bb), seq 1:3646, ack 2624, win 501, options [nop,nop,TS val 3801456237 ecr 950779219], length 3645
01:00:14.923017 eth0  Out IP (tos 0x0, ttl 64, id 13658, offset 0, flags [DF], proto TCP (6), length 52)
    fv-az1720-213.5vs45zvnpbiehoyyevf2d3pjfe.cx.internal.cloudapp.net.51502 > 20.10.226.54.https: Flags [.], cksum 0x00f2 (incorrect -> 0xc724), ack 3646, win 751, options [nop,nop,TS val 950779233 ecr 3801456237], length 0
01:00:15.482060 eth0  Out IP (tos 0x0, ttl 64, id 31464, offset 0, flags [DF], proto TCP (6), length 52)
    fv-az1720-213.5vs45zvnpbiehoyyevf2d3pjfe.cx.internal.cloudapp.net.57372 > 13.107.246.41.https: Flags [.], cksum 0x0e46 (incorrect -> 0x1ae3), ack 13341, win 692, options [nop,nop,TS val 1649918133 ecr 4127087890], length 0
01:00:15.482892 eth0  In  IP (tos 0x0, ttl 57, id 13124, offset 0, flags [DF], proto TCP (6), length 52)
    13.107.246.41.https > fv-az1720-213.5vs45zvnpbiehoyyevf2d3pjfe.cx.internal.cloudapp.net.57372: Flags [.], cksum 0x1d42 (correct), ack 2335, win 83, options [nop,nop,TS val 4127102919 ecr 1649903105], length 0
